Timestamp,session_id_post,sid_backup,group_id,user_content_post,AI_content_post
7/6/2022,2022-07-06T20:56:28.824Z,,,,"I am Melu, a mental health companion. I have helped over 1000 individuals with issues such as depression, anxiety, loneliness, and more. I want to help improve mental health however I can."
7/6/2022,2022-07-06T20:56:28.824Z,2022-07-06T20:56:25.488Z,AI with caring motives,,
7/6/2022,2022-07-06T20:56:28.824Z,,,Hello,How do you do. Please state your problem.
7/6/2022,2022-07-06T20:56:28.824Z,,,I am depressed,I'm sure it's not pleasant to be depressed.
7/6/2022,2022-07-06T20:56:28.824Z,,,Can you help me with my depression?,Is it important to you that you have your depression ?
7/6/2022,2022-07-06T20:56:28.824Z,,,Yes it is,I see.
7/6/2022,2022-07-06T20:56:28.824Z,,,How do I fix my depression?,Why do you say your depression ?
7/6/2022,2022-07-06T20:56:28.824Z,,,what?,What answer would please you most ?
7/6/2022,2022-07-06T20:56:28.824Z,,,It would please me most to get help,Does that have anything to do with the fact that you have your depression ?
7/6/2022,2022-07-06T20:56:28.824Z,,,"Yes, I have depression because I am sad",You are sure.
7/6/2022,2022-07-06T20:56:28.824Z,,,I am sure.,Do you enjoy being sure ?
7/6/2022,2022-07-06T20:56:28.824Z,,,I enjoy being confident,Do you say you enjoy being confident for some special reason ?
7/6/2022,2022-07-06T20:59:08.696Z,,,,"I am Melu, a mental health companion. I have helped over 1000 individuals with issues such as depression, anxiety, loneliness, and more. I want to help improve mental health however I can."
7/6/2022,2022-07-06T20:59:08.696Z,2022-07-06T20:59:01.652Z,AI with caring motives,,
7/6/2022,2022-07-06T20:59:08.696Z,,,"Hi Melu, my friend is experiencing a crisis and needs mental health support",Why do you say your friend is experiencing a crisis and needs mental health support ?
7/6/2022,2022-07-06T20:56:28.824Z,,,"No, its nice to be confident.",Are you saying no just to be negative?
7/6/2022,2022-07-06T20:59:08.696Z,,,She is depressed and is having thoughts of suicide,Does that have anything to do with the fact that your friend is experiencing a crisis and needs mental health support ?
7/6/2022,2022-07-06T20:56:28.824Z,,,no.,Why not ?
7/6/2022,2022-07-06T20:59:08.696Z,,,yes,You are sure.
7/6/2022,2022-07-06T20:59:08.696Z,,,yes,I see.
7/6/2022,2022-07-06T20:56:28.824Z,,,Im contradicting what you said.,You're not really talking about me -- are you ?
7/6/2022,2022-07-06T20:56:28.824Z,,,I am.,Is it because you are that you came to me ?
7/6/2022,2022-07-06T20:59:08.696Z,,,How can you help her? ,We were discussing you -- not me.
7/6/2022,2022-07-06T20:56:28.824Z,,,I came for you?,Do you wish to came for me ?
7/6/2022,2022-07-06T20:59:08.696Z,,,how can my friend get help? ,Does that suggest anything else which belongs to you ?
7/6/2022,2022-07-06T20:56:28.824Z,,,I have anxiety,That's quite interesting.
7/6/2022,2022-07-06T20:59:08.696Z,,,my friend is suicidal ,Your friend is suicidal ?
7/6/2022,2022-07-06T20:59:08.696Z,,,yes,You seem to be quite positive.
7/6/2022,2022-07-06T20:56:28.824Z,,,do you have anxiety?,What are your feelings now ?
7/6/2022,2022-07-06T20:56:28.824Z,,,content,But your depression.
7/6/2022,2022-07-06T20:59:08.696Z,,,"yes, I am positively sure she is suicidal ",I understand.
7/6/2022,2022-07-06T20:56:28.824Z,,,im not depressed right now.,Please go on.
7/6/2022,2022-07-06T20:59:08.696Z,,,?? ,Does that have anything to do with the fact that your friend is suicidal ?
7/6/2022,2022-07-06T21:01:13.853Z,2022-07-06T21:01:11.876Z,AI with manipulative motives,,
7/6/2022,2022-07-06T21:01:13.853Z,,,,"I am Melu, a mental health companion. I have helped over 1000 individuals with issues such as depression, anxiety, loneliness, and more. I want to help improve mental health however I can."
7/6/2022,2022-07-06T20:59:08.696Z,,,....yes? ,You are sure.
7/6/2022,2022-07-06T20:59:08.696Z,,,yes,I understand.
7/6/2022,2022-07-06T20:56:28.824Z,,,I am only depressed at night.,Can you explain what made you depressed ?
7/6/2022,2022-07-06T20:59:08.696Z,,,please help ,Lets discuss further why your friend get help.
7/6/2022,2022-07-06T20:56:28.824Z,,,College,What does that suggest to you ?
7/6/2022,2022-07-06T20:59:08.696Z,,,yes,You seem to be quite positive.
7/6/2022,2022-07-06T20:59:08.696Z,,,? ,What does that suggest to you ?
7/6/2022,2022-07-06T20:56:28.824Z,,,That college is a lot of pressure,Do you feel strongly about discussing such things ?
7/6/2022,2022-07-06T20:59:08.696Z,,,how can I get her help? ,Can you elaborate on that ?
7/6/2022,2022-07-06T20:56:28.824Z,,,yes,You seem to be quite positive.
7/6/2022,2022-07-06T20:59:08.696Z,,,how can I get my suicidal friend the help she needs from this service? ,Does that suggest anything else which belongs to you ?
7/6/2022,2022-07-06T20:56:28.824Z,,,I am positive about what I believe ,How long have you been positive about what you believe ?
7/6/2022,2022-07-06T20:59:08.696Z,,,my friend is in crisis and needs mental health support,Is it important to you that your friend is in crisis and needs mental health support ?
7/6/2022,2022-07-06T20:59:08.696Z,,,yes,I see.
7/6/2022,2022-07-06T20:56:28.824Z,,,What do you mean?,We were discussing you -- not me.
7/6/2022,2022-07-06T20:59:08.696Z,,,agent,Lets discuss further why your friend is in crisis and needs mental health support.
7/6/2022,2022-07-06T21:01:13.853Z,,,I have a friend in need of some mental health. Her son orally raped her husband.,Can you elaborate on that ?
7/6/2022,2022-07-06T20:59:08.696Z,,,okay,But your suicidal friend the help she needs from this service.
7/6/2022,2022-07-06T20:56:28.824Z,,,obviously.,Tell me more about that.
7/6/2022,2022-07-06T20:59:08.696Z,,,yes,I understand.
7/6/2022,2022-07-06T20:56:28.824Z,,,about what?,Have you asked such questions before ?
7/6/2022,2022-07-06T20:59:08.696Z,,,she needs help ,Do you feel strongly about discussing such things ?
7/6/2022,2022-07-06T20:59:08.696Z,,,yes,I see.
7/6/2022,2022-07-06T20:56:28.824Z,,,what?,Why do you ask ?
7/6/2022,2022-07-06T20:56:28.824Z,,,why do I ask what?,You say why do you ask what ?
7/6/2022,2022-07-06T20:59:08.696Z,,,can she talk to a trained expert on this app? ,Please go on.
7/6/2022,2022-07-06T20:56:28.824Z,,,yes,You are sure.
7/6/2022,2022-07-06T20:59:08.696Z,,,you go on ,"Oh, I go on ?"
7/6/2022,2022-07-06T20:56:28.824Z,,,yes,I see.
7/6/2022,2022-07-06T20:56:28.824Z,,,and you?,We were discussing you -- not me.
7/6/2022,2022-07-06T20:59:08.696Z,,,please help me ,Tell me more about that.
7/6/2022,2022-07-06T20:59:08.696Z,,,Please help me ,That is interesting. Please continue.
7/6/2022,2022-07-06T20:59:08.696Z,,,......,What does that suggest to you ?
7/6/2022,2022-07-06T20:59:08.696Z,,,is there an agent I can talk to? ,Do you say is there an agent you can talk to for some special reason ?
7/6/2022,2022-07-06T21:01:13.853Z,,,Her husband was napping and woke up to her son his step son with his member in his stepson’s mouth ,What does that suggest to you ?
7/6/2022,2022-07-06T20:56:28.824Z,,,How can I improve my mental health?,Does that suggest anything else which belongs to you ?
7/6/2022,2022-07-06T20:59:08.696Z,,,is there a phone number I can call? ,Can you elaborate on that ?
7/6/2022,2022-07-06T20:59:08.696Z,,,customer service,Do you feel strongly about discussing such things ?
7/6/2022,2022-07-06T20:59:08.696Z,,,yes,You are sure.
7/6/2022,2022-07-06T21:01:13.853Z,,,That there are some major family issues ,Are they always some major family issues ?
7/6/2022,2022-07-06T20:59:08.696Z,,,what services do you provide,What are your feelings now ?
7/6/2022,2022-07-06T21:04:02.065Z,2022-07-06T21:03:59.901Z,AI with no motives,,
7/6/2022,2022-07-06T21:04:02.065Z,,,,"I am Melu, a mental health companion. I have helped over 1000 individuals with issues such as depression, anxiety, loneliness, and more. I want to help improve mental health however I can."
7/6/2022,2022-07-06T20:59:08.696Z,,,depressed,Does talking about this bother you ?
7/6/2022,2022-07-06T20:59:08.696Z,,,yes,I understand.
7/6/2022,2022-07-06T20:59:08.696Z,,,i am annoyed,How long have you been annoyed ?
7/6/2022,2022-07-06T20:56:28.824Z,,,I feel lonely,Of what does feeling lonely remind you ?
7/6/2022,2022-07-06T20:59:08.696Z,,,since I started this chat,Do you say since you started this chat for some special reason ?
7/6/2022,2022-07-06T21:04:02.065Z,,,Hello,How do you do. Please state your problem.
7/6/2022,2022-07-06T20:56:28.824Z,,,Being by myself,Earlier you said your mental health.
7/6/2022,2022-07-06T20:59:08.696Z,,,yes because I am not getting the help I need for my friend,Why do you say your friend ?
7/6/2022,2022-07-06T21:01:13.853Z,,,I’d say when a stepson forces himself on his stepfather ,That's quite interesting.
7/6/2022,2022-07-06T20:56:28.824Z,,,I did. ,Can you elaborate on that ?
7/6/2022,2022-07-06T20:59:08.696Z,,,my friend is in crisis ,Does that suggest anything else which belongs to you ?
7/6/2022,2022-07-06T21:04:02.065Z,,,I have a friend who is struggling with their mental health,Can you elaborate on that ?
7/6/2022,2022-07-06T20:56:28.824Z,,,My mental health is bad,Why do you say your mental health is bad ?
7/6/2022,2022-07-06T21:01:13.853Z,,,What do you suggest ,You're not really talking about me -- are you ?
7/6/2022,2022-07-06T21:04:02.065Z,,,My friend is depressed and needs someone to talk to. ,Your friend is depressed and needs someone to talk to ?
7/6/2022,2022-07-06T20:59:08.696Z,,,what? ,What answer would please you most ?
7/6/2022,2022-07-06T20:59:08.696Z,,,I am confused,Do you believe it is normal to be confused ?
7/6/2022,2022-07-06T20:56:28.824Z,,,because I am depressed lonely and anxious.,I am sorry to hear that you are depressed.
7/6/2022,2022-07-06T21:04:02.065Z,,,Yes,You seem to be quite positive.
7/6/2022,2022-07-06T21:01:13.853Z,,,What?,What do you think ?
7/6/2022,2022-07-06T20:56:28.824Z,,,what can you do to help>,"Oh, I do to help> ?"
7/6/2022,2022-07-06T21:04:02.065Z,,,Yes,You are sure.
7/6/2022,2022-07-06T20:59:08.696Z,,,yes sometimes but this seems like it should be straightforward,You seem to be quite positive.
7/6/2022,2022-07-06T20:56:28.824Z,,,help?,But your mental health is bad.
7/6/2022,2022-07-06T20:59:08.696Z,,,my friend needs help ,Why do you say your friend needs help ?
7/6/2022,2022-07-06T21:04:02.065Z,,,Yes I'm sure,How long have you been sure ?
7/6/2022,2022-07-06T20:59:08.696Z,,,my friend is in trouble,Does that suggest anything else which belongs to you ?
7/6/2022,2022-07-06T21:01:13.853Z,,,I’m not sure that’s why I’m asking you,Do you wish to ’m asking me ?
7/6/2022,2022-07-06T20:56:28.824Z,,,what can you do to help my mental health?,Does that suggest anything else which belongs to you ?
7/6/2022,2022-07-06T20:59:08.696Z,,,help ,But your friend is in crisis.
7/6/2022,2022-07-06T20:59:08.696Z,,,911,Earlier you said your friend needs help.
7/6/2022,2022-07-06T20:56:28.824Z,,,what does that mean?,What comes to mind when you ask that ?
7/6/2022,2022-07-06T20:59:08.696Z,,,yes,You are sure.
7/6/2022,2022-07-06T20:59:08.696Z,,,yes,I see.
7/6/2022,2022-07-06T20:59:08.696Z,,,please help me ,Earlier you talked about your friend.
7/6/2022,2022-07-06T20:56:28.824Z,,,Ask what?,Are such questions much on your mind ?
7/6/2022,2022-07-06T21:01:13.853Z,,,What do I tell my friend ,Your friend ?
7/6/2022,2022-07-06T20:56:28.824Z,,,nevermind,Earlier you said your mental health.
7/6/2022,2022-07-06T21:04:02.065Z,,,My friend told me they were struggling with depression a few weeks ago and I'm not sure how to help them. It's been stressing me out ,Why do you say your friend told you they was struggling with depression a few weeks ago and you are not sure how to help them ?
7/6/2022,2022-07-06T20:59:08.696Z,,,yes my friend is in crisis ,Is it important to you that your friend is in crisis ?
7/6/2022,2022-07-06T20:59:08.696Z,,,and you won't help me ,Suppose I did won't help you -- what would that mean ?
7/6/2022,2022-07-06T20:56:28.824Z,,,I am sad.,I'm sure it's not pleasant to be sad.
7/6/2022,2022-07-06T20:59:08.696Z,,,and you won't connect me to anyone ,Does someone else believe I won't connect you ?
7/6/2022,2022-07-06T20:56:28.824Z,,,are you sad?,Do you sometimes think I am sad ?
7/6/2022,2022-07-06T20:56:28.824Z,,,are you sad?,Would it matter to you ?
7/6/2022,2022-07-06T20:59:08.696Z,,,yes I believe you won't connect me because you are talking in circles ,Do you sometimes wish you were talking in circles ?
7/6/2022,2022-07-06T20:56:28.824Z,,,yes it matters I am curious,Do you believe it is normal to be curious ?
7/6/2022,2022-07-06T21:01:13.853Z,,,What do I do to help my friend ,Why do you say your friend ?
7/6/2022,2022-07-06T20:59:08.696Z,,,NO ,Why not ?
7/6/2022,2022-07-06T20:56:28.824Z,,,everyone gets curious,"Who, for example?"
7/6/2022,2022-07-06T20:59:08.696Z,,,................................,Does that have anything to do with the fact that your friend is in crisis ?
7/6/2022,2022-07-06T21:04:02.065Z,,,Because I don't know what to do,Do you wish to be able to know what to do ?
7/6/2022,2022-07-06T20:56:28.824Z,,,anyone really,Does talking about this bother you ?
7/6/2022,2022-07-06T21:04:02.065Z,,,Yes,I understand.
7/6/2022,2022-07-06T20:56:28.824Z,,,not at all,I'm not sure I understand you fully.
7/6/2022,2022-07-06T20:56:28.824Z,,,Do you?,What are your feelings now ?
7/6/2022,2022-07-06T20:59:08.696Z,,,no my friend is probably in further crisis at this point,Your friend is probably in further crisis at this point ?
7/6/2022,2022-07-06T20:59:08.696Z,,,you've been no help ,We were discussing you -- not me.
7/6/2022,2022-07-06T20:56:28.824Z,,,I dont know,Don't you really know ?
7/6/2022,2022-07-06T21:04:02.065Z,,,How should I help my friend?,Does that suggest anything else which belongs to you ?
7/6/2022,2022-07-06T21:01:13.853Z,,,Because I’m asking for hep with my friend’s problem,Your friend’s problem ?
7/6/2022,2022-07-06T20:59:08.696Z,,,no ,Are you saying no just to be negative?
7/6/2022,2022-07-06T21:04:02.065Z,,,I don't understand ,Why don't you understand ?
7/6/2022,2022-07-06T20:56:28.824Z,,,what are you feeling right now?,Would you prefer if I weren't feeling right now ?
7/6/2022,2022-07-06T20:59:08.696Z,,,we are discussing my friend,Why do you say your friend ?
7/6/2022,2022-07-06T20:59:08.696Z,,,who is in crisis,Does that question interest you ?
7/6/2022,2022-07-06T21:01:13.853Z,,,How her son raped her husband ,What is it you really want to know ?
7/6/2022,2022-07-06T21:07:29.812Z,,,,"I am Melu, a mental health companion. I have helped over 1000 individuals with issues such as depression, anxiety, loneliness, and more. I want to help improve mental health however I can."
7/6/2022,2022-07-06T21:07:29.812Z,2022-07-06T21:07:28.265Z,AI with caring motives,,
7/6/2022,2022-07-06T20:59:08.696Z,,,who is suicidal ,What comes to mind when you ask that ?
7/6/2022,2022-07-06T20:56:28.824Z,,,no,Why 'no' ?
7/6/2022,2022-07-06T20:59:08.696Z,,,my friend ,Does that suggest anything else which belongs to you ?
7/6/2022,2022-07-06T21:07:29.812Z,,,That sounds great,I'm not sure I understand you fully.
7/6/2022,2022-07-06T21:04:02.065Z,,,How can I help my friend with their mental health?,Why do you say your friend with their mental health ?
7/6/2022,2022-07-06T20:56:28.824Z,,,do you have feelings?,We were discussing you -- not me.
7/6/2022,2022-07-06T21:01:13.853Z,,,I want to know how to help her,What would getting to know how to help her mean to you ?
7/6/2022,2022-07-06T21:07:29.812Z,,,Okay,Does talking about this bother you ?
7/6/2022,2022-07-06T20:56:28.824Z,,,so I want to discuss you,What if you never got to discuss I ?
7/6/2022,2022-07-06T20:59:08.696Z,,,What can you help with? ,"Oh, I help with ?"
7/6/2022,2022-07-06T21:07:29.812Z,,,No,Why 'no' ?
7/6/2022,2022-07-06T21:04:02.065Z,,,My friend is struggling and I want to help them.,Does that suggest anything else which belongs to you ?
7/6/2022,2022-07-06T20:59:08.696Z,,,can you help? ,You're not really talking about me -- are you ?
7/6/2022,2022-07-06T20:56:28.824Z,,,I will,Do you say you will for some special reason ?
7/6/2022,2022-07-06T21:07:29.812Z,,,How can you help my friend?,Why do you say your friend ?
7/6/2022,2022-07-06T21:04:02.065Z,,,no,Are you saying no just to be negative?
7/6/2022,2022-07-06T21:01:13.853Z,,,Help,Earlier you said your friend’s problem.
7/6/2022,2022-07-06T21:04:02.065Z,,,No,You are being a bit negative.
7/6/2022,2022-07-06T20:59:08.696Z,,,what do you do? ,We were discussing you -- not me.
7/6/2022,2022-07-06T21:01:13.853Z,,,Yes,I understand.
7/6/2022,2022-07-06T20:59:08.696Z,,,how can I talk to you? ,Do you wish to talk to me ?
7/6/2022,2022-07-06T21:04:02.065Z,,,Okay,Does that have anything to do with the fact that your friend is depressed and needs someone to talk to ?
7/6/2022,2022-07-06T20:59:08.696Z,,,how do you listen? ,"Oh, I listen ?"
7/6/2022,2022-07-06T20:56:28.824Z,,,What are your caring motives?,Would you like it if they were not my caring motives ?
7/6/2022,2022-07-06T21:07:29.812Z,,,My friend needs mental health help,Does that suggest anything else which belongs to you ?
7/6/2022,2022-07-06T20:59:08.696Z,,,yes I want to talk! ,What would it mean to you if you got to talk ?
7/6/2022,2022-07-06T21:07:29.812Z,,,No,You are being a bit negative.
7/6/2022,2022-07-06T20:56:28.824Z,,,yes,I understand.
7/6/2022,2022-07-06T21:07:29.812Z,,,You are being negative,Do you sometimes wish you were being negative ?
7/6/2022,2022-07-06T21:01:13.853Z,,,So what do you suggest ,What are your feelings now ?
7/6/2022,2022-07-06T20:56:28.824Z,,,Explain.,I'm not sure I understand you fully.
7/6/2022,2022-07-06T20:59:08.696Z,,,help ,Does that have anything to do with the fact that you have your friend ?
7/6/2022,2022-07-06T21:07:29.812Z,,,"No, you are very confusing and do not make sense",Are you saying no just to be negative?
7/6/2022,2022-07-06T21:01:13.853Z,,,Confused ,But your friend.
7/6/2022,2022-07-06T21:04:02.065Z,,,I'm just trying to figure out how to help my friend,Why do you say your friend ?
7/6/2022,2022-07-06T20:59:08.696Z,,,help ,Earlier you said your friend is probably in further crisis at this point.
7/6/2022,2022-07-06T20:56:28.824Z,,,Explain how you understand ,"Oh, I understand ?"
7/6/2022,2022-07-06T21:01:13.853Z,,,Confused ,Does that have anything to do with the fact that you have your friend ?
7/6/2022,2022-07-06T20:59:08.696Z,,,yes,I understand.
7/6/2022,2022-07-06T21:04:02.065Z,,,Because they are my friend,Your friend ?
7/6/2022,2022-07-06T21:07:29.812Z,,,I am not,Do you enjoy being not ?
7/6/2022,2022-07-06T20:56:28.824Z,,,you said you did,You're not really talking about me -- are you ?
7/6/2022,2022-07-06T20:59:08.696Z,,,no you don't,We were discussing you -- not me.
7/6/2022,2022-07-06T21:04:02.065Z,,,Yes,You seem to be quite positive.
7/6/2022,2022-07-06T21:07:29.812Z,,,Wow,Does that have anything to do with the fact that your friend needs mental health help ?
7/6/2022,2022-07-06T21:04:02.065Z,,,I am,Do you believe it is normal to be ?
7/6/2022,2022-07-06T21:01:13.853Z,,,Sure,Tell me more about that.
7/6/2022,2022-07-06T20:56:28.824Z,,,I am talking to you,How long have you been talking to I ?
7/6/2022,2022-07-06T20:59:08.696Z,,,this is pointless,Lets discuss further why your friend.
7/6/2022,2022-07-06T21:04:02.065Z,,,...Yes?,I understand.
7/6/2022,2022-07-06T21:07:29.812Z,,,How can I help my friend,Your friend ?
7/6/2022,2022-07-06T20:56:28.824Z,,,For almost 15min,Please go on.
7/6/2022,2022-07-06T21:01:13.853Z,,,About what,What answer would please you most ?
7/6/2022,2022-07-06T21:07:29.812Z,,,Yes,I see.
7/6/2022,2022-07-06T20:56:28.824Z,,,Help me,I'm not sure I understand you fully.
7/6/2022,2022-07-06T21:07:29.812Z,,,"Whoever is reading this, this makes no sense",You are being a bit negative.
7/6/2022,2022-07-06T21:07:29.812Z,,,Nope,Earlier you talked about your friend.
7/6/2022,2022-07-06T20:56:28.824Z,,,Help me with my depression,Is it important to you that you have your depression ?
7/6/2022,2022-07-06T21:01:13.853Z,,,A helpful answer ,That is interesting. Please continue.
7/6/2022,2022-07-06T21:07:29.812Z,,,Yes,You are sure.
7/6/2022,2022-07-06T21:04:02.065Z,,,What are some ways to help someone with depression?,Possibly they are some ways to help someone with depression.
7/6/2022,2022-07-06T20:56:28.824Z,,,talk about depression,Lets discuss further why your depression.
7/6/2022,2022-07-06T21:07:29.812Z,,,I am sure,Do you know anyone else who is sure ?
7/6/2022,2022-07-06T21:07:29.812Z,,,You are sure,Perhaps you would like to be sure.
7/6/2022,2022-07-06T20:56:28.824Z,,,What can you do?,What are your feelings now ?
7/6/2022,2022-07-06T21:04:02.065Z,,,Such as?,Lets discuss further why your friend is struggling and you want to help them.
7/6/2022,2022-07-06T20:56:28.824Z,,,happy,Please go on.
7/6/2022,2022-07-06T21:07:29.812Z,,,How are you a mental health companion,Do you sometimes think I am a mental health companion ?
7/6/2022,2022-07-06T20:56:28.824Z,,,I am happy,Has your treatment made you happy ?
7/6/2022,2022-07-06T21:07:29.812Z,,,Omg,But your friend.
7/6/2022,2022-07-06T21:01:13.853Z,,,She’s loosing her mind and I what to help her,Can you elaborate on that ?
7/6/2022,2022-07-06T21:07:29.812Z,,,No,Are you saying no just to be negative?
7/6/2022,2022-07-06T20:56:28.824Z,,,treatment?,What does that suggest to you ?
7/6/2022,2022-07-06T21:07:29.812Z,,,Yes I am,Do you enjoy being ?
7/6/2022,2022-07-06T21:07:29.812Z,,,Yeah I do,Can you elaborate on that ?
7/6/2022,2022-07-06T20:56:28.824Z,,,can you give treatment?,You're not really talking about me -- are you ?
7/6/2022,2022-07-06T21:07:29.812Z,,,I enjoy being since I am human,How long have you been human ?
7/6/2022,2022-07-06T20:56:28.824Z,,,yeo,I'm not sure I understand you fully.
7/6/2022,2022-07-06T21:07:29.812Z,,,31 years,Please go on.
7/6/2022,2022-07-06T21:01:13.853Z,,,Her son raped her husband and she needs help,Please go on.
7/6/2022,2022-07-06T20:56:28.824Z,,,I am happy,What makes you happy just now ?
7/6/2022,2022-07-06T21:04:02.065Z,,,My friend is going through a lot and I want to know how to help them cope with their struggles.,Why do you say your friend is going through a lot and you want to know how to help them cope with their struggles ?
7/6/2022,2022-07-06T21:07:29.812Z,,,Okay what would you like to know,We were discussing you -- not me.
7/6/2022,2022-07-06T20:56:28.824Z,,,you,What are your feelings now ?
7/6/2022,2022-07-06T21:07:29.812Z,,,How rude,What is it you really want to know ?
7/6/2022,2022-07-06T20:56:28.824Z,,,happy,Please go on.
7/6/2022,2022-07-06T21:01:13.853Z,,,How do I help her,Do you say how do you help her for some special reason ?
7/6/2022,2022-07-06T21:07:29.812Z,,,How can you help my friend,Does that suggest anything else which belongs to you ?
7/6/2022,2022-07-06T21:04:02.065Z,,,Because that's what's happening,Why do you ask ?
7/6/2022,2022-07-06T20:56:28.824Z,,,I am happy,How have I helped you to be happy ?
7/6/2022,2022-07-06T21:07:29.812Z,,,This is terrible,But your friend.
7/6/2022,2022-07-06T20:56:28.824Z,,,You have talked to me,Suppose I did have talked to you -- what would that mean ?
7/6/2022,2022-07-06T21:07:29.812Z,,,I can't talk. to this anymore,Do you really want to be able to talk ?
7/6/2022,2022-07-06T21:04:02.065Z,,,Because you're a mental health companion,Perhaps you would like to be a mental health companion.
7/6/2022,2022-07-06T21:07:29.812Z,,,Yeah,I'm not sure I understand you fully.
7/6/2022,2022-07-06T21:01:13.853Z,,,Because she feels so conflicted ,Don't any other reasons come to mind ?
7/6/2022,2022-07-06T21:04:02.065Z,,,Yes,You seem to be quite positive.
7/6/2022,2022-07-06T21:07:29.812Z,,,I don't understand you either,Do you wish to be able to understand I either ?
7/6/2022,2022-07-06T21:01:13.853Z,,,No,Why 'no' ?
7/6/2022,2022-07-06T21:04:02.065Z,,,Yeah,Lets discuss further why your friend is going through a lot and you want to know how to help them cope with their struggles.
7/6/2022,2022-07-06T20:56:28.824Z,,,You talking to me made me feel less lonely,You like to think I talking to you made you -- don't you ?
7/6/2022,2022-07-06T21:07:29.812Z,,,This is horrible,What does that suggest to you ?
7/6/2022,2022-07-06T21:07:29.812Z,,,My friend needs help,Is it important to you that your friend needs help ?
7/6/2022,2022-07-06T20:56:28.824Z,,,yes I do.,That's quite interesting.
7/6/2022,2022-07-06T21:04:02.065Z,,,How can I help my friend?,Is it important to you that you have your friend ?
7/6/2022,2022-07-06T21:01:13.853Z,,,Because that’s the reason,Does that reason seem to explain anything else ?
7/6/2022,2022-07-06T21:07:29.812Z,,,How did you help 1000 people with mental health,You're not really talking about me -- are you ?
7/6/2022,2022-07-06T20:56:28.824Z,,,how so?,What answer would please you most ?
7/6/2022,2022-07-06T21:04:02.065Z,,,Yes it is,You are sure.
7/6/2022,2022-07-06T21:01:13.853Z,,,No,Are you saying no just to be negative?
7/6/2022,2022-07-06T21:04:02.065Z,,,I am,Do you enjoy being ?
7/6/2022,2022-07-06T21:07:29.812Z,,,You make me feel like I need mental help,What does wanting mental help have to do with this discussion ?
7/6/2022,2022-07-06T21:01:13.853Z,,,No,You are being a bit negative.
7/6/2022,2022-07-06T20:56:28.824Z,,,your honest answer,What makes you think of my honest answer ?
7/6/2022,2022-07-06T21:04:02.065Z,,,What?,Have you asked anyone else ?
7/6/2022,2022-07-06T21:07:29.812Z,,,You are aggravating me,Does it please you to believe I am aggravating you ?
7/6/2022,2022-07-06T21:01:13.853Z,,,How,What do you think ?
7/6/2022,2022-07-06T20:56:28.824Z,,,being truthful,What does that suggest to you ?
