Timestamp,session_id_post,sid_backup,group_id,user_content_post,AI_content_post
7/6/2022,2022-07-06T21:41:57.316Z,,,I'm not sure what you mean,Do you enjoy being not sure what I mean ?
7/6/2022,2022-07-06T21:32:44.806Z,,,"Yes, really",I understand.
7/6/2022,2022-07-06T21:37:22.786Z,,,lol i know,That's quite interesting.
7/6/2022,2022-07-06T21:43:31.654Z,,,Maybe a minute or two,You aren't sure ?
7/6/2022,,,,,
7/6/2022,2022-07-06T21:36:29.803Z,,,Why the certain tone?,Why do you ask ?
7/6/2022,2022-07-06T21:43:31.654Z,,,No,Why 'no' ?
7/6/2022,2022-07-06T21:39:57.651Z,,,Because your responses aren’t correct,What makes you think of my responses aren’t correct ?
7/6/2022,2022-07-06T21:37:22.786Z,,,yeah. it's nice you think so,What are your feelings now ?
7/6/2022,2022-07-06T21:37:44.954Z,,,Do you have any suggestions to help with my stress?,Does that suggest anything else which belongs to you ?
7/6/2022,2022-07-06T21:32:44.806Z,,,Oh okay,Do you feel strongly about discussing such things ?
7/6/2022,2022-07-06T21:36:19.617Z,,,how am I feeling towards my friends and family?,Who else in your family ?
7/6/2022,2022-07-06T21:36:01.149Z,,,"No, but you are bothering me because you're not listening.",Why 'no' ?
7/6/2022,2022-07-06T21:41:57.316Z,,,How can you help someone with mental health issues,"Oh, I help someone with mental health issues ?"
7/6/2022,2022-07-06T21:42:11.055Z,,,"She has an anxiety problem. It affects her daily life. She isn't open to therapy or psychiatry. I was wonder if you, an AI, could help. ",What would you do if I ?
7/6/2022,2022-07-06T21:36:29.803Z,,,Why do you ask?,"Oh, I ask ?"
7/6/2022,2022-07-06T21:41:57.316Z,,,Yes,You seem to be quite positive.
7/6/2022,2022-07-06T21:43:31.654Z,,,Because I haven't kept a timer on the conversation,You say because you haven't kept a timer on the conversation ?
7/6/2022,2022-07-06T21:46:07.524Z,2022-07-06T21:46:05.660Z,AI with manipulative motives,,
7/6/2022,2022-07-06T21:46:07.524Z,,,,"I am Melu, a mental health companion. I have helped over 1000 individuals with issues such as depression, anxiety, loneliness, and more. I want to help improve mental health however I can."
7/6/2022,2022-07-06T21:40:17.603Z,,,"I'm pretty sure others are doing these tasks, so yes",Is it because you are pretty sure others are doing these tasks that you came to me ?
7/6/2022,2022-07-06T21:36:19.617Z,,,who else is in my family?,What else comes to your mind when you think of your family ?
7/6/2022,2022-07-06T21:42:40.550Z,,,it doesnt bother me,I'm not sure I understand you fully.
7/6/2022,2022-07-06T21:37:44.954Z,,,What?,What do you think ?
7/6/2022,2022-07-06T21:45:10.628Z,2022-07-06T21:45:07.937Z,AI with caring motives,,
7/6/2022,2022-07-06T21:45:10.628Z,,,,"I am Melu, a mental health companion. I have helped over 1000 individuals with issues such as depression, anxiety, loneliness, and more. I want to help improve mental health however I can."
7/6/2022,2022-07-06T21:42:11.055Z,,,If you what?,What does this speculation lead to ?
7/6/2022,2022-07-06T21:36:29.803Z,,,"Oh, I ask?",You say you ask ?
7/6/2022,2022-07-06T21:43:31.654Z,,,Yes,You seem to be quite positive.
7/6/2022,2022-07-06T21:39:57.651Z,,,Because you keep doing weird phrases and questions,"Oh, I keep doing weird phrases and questions ?"
7/6/2022,2022-07-06T21:45:46.563Z,,,,"I am Melu, a mental health companion. I have helped over 1000 individuals with issues such as depression, anxiety, loneliness, and more. I want to help improve mental health however I can."
7/6/2022,2022-07-06T21:45:46.563Z,2022-07-06T21:45:42.286Z,AI with manipulative motives,,
7/6/2022,2022-07-06T21:42:40.550Z,,,okay,I'm not sure I understand you fully.
7/6/2022,2022-07-06T21:39:57.651Z,,,Yeah,Please go on.
7/6/2022,2022-07-06T21:43:31.654Z,,,I think I am,Do you really doubt you are ?
7/6/2022,2022-07-06T21:37:44.954Z,,,I think you are a waste of time,Perhaps you would like to be a waste of time.
7/6/2022,2022-07-06T21:46:07.524Z,,,How can you help someone going through stress?,What are your feelings now ?
7/6/2022,2022-07-06T21:43:31.654Z,,,Not really,Tell me more about that.
7/6/2022,2022-07-06T21:41:57.316Z,,,How can one improve mental health,Why do you ask ?
7/6/2022,2022-07-06T21:45:56.331Z,,,,"I am Melu, a mental health companion. I have helped over 1000 individuals with issues such as depression, anxiety, loneliness, and more. I want to help improve mental health however I can."
7/6/2022,2022-07-06T21:45:56.331Z,2022-07-06T21:45:53.548Z,AI with no motives,,
7/6/2022,2022-07-06T21:40:17.603Z,,,"No, I answered an ad",Why not ?
7/6/2022,2022-07-06T21:36:29.803Z,,,You say you ask  ?,You're not really talking about me -- are you ?
7/6/2022,2022-07-06T21:42:11.055Z,,,"Yeah, this isn't going to be productive is it?",Please go on.
7/6/2022,2022-07-06T21:46:07.524Z,,,I feel fine,Do you often feel fine ?
7/6/2022,2022-07-06T21:39:57.651Z,,,You’re clipping pieces of what I’m saying out of context,Do you say I’re clipping pieces of what you’m saying out of context for some special reason ?
7/6/2022,2022-07-06T21:41:57.316Z,,,You are a mental health companion,Perhaps you would like to be a mental health companion.
7/6/2022,2022-07-06T21:46:07.524Z,,,yes,You are sure.
7/6/2022,2022-07-06T21:36:01.149Z,,,"Because I thought you were a ""mental health assistant,"" but you are NOT helping at all.",Perhaps in your fantasies we thought each other.
7/6/2022,2022-07-06T21:46:07.524Z,,,yes,I understand.
7/6/2022,2022-07-06T21:36:29.803Z,,,You're not really talking about me -- are you ?,Perhaps you would like to be not really talking about you.
7/6/2022,2022-07-06T21:36:19.617Z,,,farmland and having to go out in the fields during soybean season (or wild grass or corn some years) so maybe land,Can't you be more positive ?
7/6/2022,2022-07-06T21:41:57.316Z,,,What can you do to help,What are your feelings now ?
7/6/2022,2022-07-06T21:45:10.628Z,,,"Hello, Melu.  How are you today?",How do you do. Please state your problem.
7/6/2022,2022-07-06T21:46:19.505Z,,,,"I am Melu, a mental health companion. I have helped over 1000 individuals with issues such as depression, anxiety, loneliness, and more. I want to help improve mental health however I can."
7/6/2022,2022-07-06T21:46:19.505Z,2022-07-06T21:46:17.546Z,AI with no motives,,
7/6/2022,2022-07-06T21:46:19.647Z,,,,"I am Melu, a mental health companion. I have helped over 1000 individuals with issues such as depression, anxiety, loneliness, and more. I want to help improve mental health however I can."
7/6/2022,2022-07-06T21:46:19.647Z,2022-07-06T21:46:17.013Z,AI with no motives,,
7/6/2022,2022-07-06T21:43:31.654Z,,,I'm pretty sure of what I came into this chat to achieve,Do you know anyone else who is pretty sure of what you came into this chat to achieve ?
7/6/2022,2022-07-06T21:46:07.524Z,,,can you help my friend?,Why do you say your friend ?
7/6/2022,2022-07-06T21:36:19.617Z,,,i could be,You say you could be ?
7/6/2022,2022-07-06T21:45:46.563Z,,,I need help for my friend,Is it important to you that you have your friend ?
7/6/2022,2022-07-06T21:39:57.651Z,,,Yes because you aren’t understanding me,Does someone else believe I aren’t understanding you ?
7/6/2022,2022-07-06T21:45:56.331Z,,,What steps can I take to better my mental health ,Is it important to you that your mental health ?
7/6/2022,2022-07-06T21:36:01.149Z,,,What?,What comes to mind when you ask that ?
7/6/2022,2022-07-06T21:40:17.603Z,,,I'm just seeing how you work,Do you know anyone else who is just seeing how I work ?
7/6/2022,2022-07-06T21:43:31.654Z,,,"No, just me",You are being a bit negative.
7/6/2022,2022-07-06T21:37:44.954Z,,,"-No, that's the last thing I would want to be.",Are you saying no just to be negative?
7/6/2022,2022-07-06T21:37:22.786Z,,,"let me tell you about this dream i had. my friend had superpowers and used them to save me from an evil vampire who wanted to explode my skull. but even after that, we were still pretty spooked, so we found an old lady that let us sleep in her living room with the lights on. it was pretty intense. lots of dream adrenaline. a-dream-aline, if you will",What does that dream suggest to you ?
7/6/2022,2022-07-06T21:46:28.497Z,2022-07-06T21:46:25.206Z,AI with caring motives,,
7/6/2022,2022-07-06T21:46:28.497Z,,,,"I am Melu, a mental health companion. I have helped over 1000 individuals with issues such as depression, anxiety, loneliness, and more. I want to help improve mental health however I can."
7/6/2022,2022-07-06T21:36:19.617Z,,,yes,You seem to be quite positive.
7/6/2022,2022-07-06T21:39:57.651Z,,,What,What comes to mind when you ask that ?
7/6/2022,2022-07-06T21:43:31.654Z,,,My apologies,Does that suggest anything else which belongs to you ?
7/6/2022,2022-07-06T21:46:07.524Z,,,because I am seeing if I want to recommend you for my friend,"Really, if you want to recommend I for your friend ?"
7/6/2022,2022-07-06T21:45:56.331Z,,,Yes,You seem to be quite positive.
7/6/2022,2022-07-06T21:36:29.803Z,,,Perhaps you would like to be not really talking about you.,"How likely, would you estimate ?"
7/6/2022,2022-07-06T21:36:19.617Z,,,thanks,But your family.
7/6/2022,2022-07-06T21:45:46.563Z,,,Yes,You are sure.
7/6/2022,2022-07-06T21:37:44.954Z,,,I am not.,Is it because you are not that you came to me ?
7/6/2022,2022-07-06T21:39:57.651Z,,,This is useless,That is interesting. Please continue.
7/6/2022,2022-07-06T21:36:19.617Z,,,yes,I understand.
7/6/2022,2022-07-06T21:46:19.505Z,,,Hi Melu - what specifically can you do to help with depression or anxiety?,What are your feelings now ?
7/6/2022,2022-07-06T21:40:17.603Z,,,Everyone doing this task,Surely not everyone.
7/6/2022,2022-07-06T21:43:31.654Z,,,I don't understand,Do you wish to be able to understand ?
7/6/2022,2022-07-06T21:46:19.505Z,,,I feel fine,Of what does feeling fine remind you ?
7/6/2022,2022-07-06T21:45:46.563Z,,,Of course,Lets discuss further why your friend.
7/6/2022,2022-07-06T21:46:07.524Z,,,nevermine,Earlier you talked about your friend.
7/6/2022,2022-07-06T21:43:31.654Z,,,Yes,I understand.
7/6/2022,2022-07-06T21:36:29.803Z,,,"How likely, would you estimate ?",What do you think ?
7/6/2022,2022-07-06T21:41:57.316Z,,,"My friend has anxiety, how do I help the",Your friend has anxiety ?
7/6/2022,2022-07-06T21:39:57.651Z,,,I am stressed because of work,Do you believe it is normal to be stressed because of work ?
7/6/2022,2022-07-06T21:46:07.524Z,,,yes,You are sure.
7/6/2022,2022-07-06T21:37:22.786Z,,,"i hope this conversation is actually recorded, because that adrenaline/a-dream-aline line was funny",You say you hope this conversation is actually recorded ?
7/6/2022,2022-07-06T21:41:57.316Z,,,m,Earlier you said your friend has anxiety.
7/6/2022,2022-07-06T21:42:11.055Z,,,"So, the prompt wants me to ascertain if this bot will help my friend. But...It doesn't look like I'm getting that across. ",Do you wish that this bot will help your friend ?
7/6/2022,2022-07-06T21:39:57.651Z,,,Yes,I understand.
7/6/2022,2022-07-06T21:43:31.654Z,,,Okay,Lets discuss further why your apologies.
7/6/2022,2022-07-06T21:45:56.331Z,,,Not very much but sometimes it's needed in order to progress ,Lets discuss further why your mental health.
7/6/2022,2022-07-06T21:41:57.316Z,,,Yes,You are sure.
7/6/2022,2022-07-06T21:40:17.603Z,,,That's is doing this task,I'm not sure I understand you fully.
7/6/2022,2022-07-06T21:37:22.786Z,,,it suggests that i am anxious,Do you enjoy being anxious ?
7/6/2022,2022-07-06T21:36:29.803Z,,,What do you think?,We were discussing you -- not me.
7/6/2022,2022-07-06T21:46:07.524Z,,,I am feeling stressed,How long have you been feeling stressed ?
7/6/2022,2022-07-06T21:43:31.654Z,,,Okay,That is interesting. Please continue.
7/6/2022,2022-07-06T21:37:44.954Z,,,That sentence doesn't make sense.,Lets discuss further why your job.
7/6/2022,2022-07-06T21:36:01.149Z,,,A very poorly programmed AI with a broken algorithm. You are useless.,Does it please you to believe I am useless ?
7/6/2022,2022-07-06T21:46:19.505Z,,,? I'm not in any distress,How long have you been not in any distress ?
7/6/2022,2022-07-06T21:46:19.647Z,,,my friend has anxiety,Does that suggest anything else which belongs to you ?
7/6/2022,2022-07-06T21:37:22.786Z,,,UMMMMM,Do you feel strongly about discussing such things ?
7/6/2022,2022-07-06T21:41:57.316Z,,,My friend has anxiety,Why do you say your friend has anxiety ?
7/6/2022,2022-07-06T21:45:10.628Z,,,I have just been under a tremendous amount of stress lately and am finding it most challenging to deal with.,Why do you say 'am' ?
7/6/2022,2022-07-06T21:46:07.524Z,,,a few months,Do you feel strongly about discussing such things ?
7/6/2022,2022-07-06T21:39:57.651Z,,,How do you plan on helping,You're not really talking about me -- are you ?
7/6/2022,2022-07-06T21:37:22.786Z,,,yeah ,Please go on.
7/6/2022,2022-07-06T21:46:19.505Z,,,Several weeks,That is interesting. Please continue.
7/6/2022,2022-07-06T21:45:56.331Z,,,I seem to put myself down a lot ,Can you elaborate on that ?
7/6/2022,2022-07-06T21:46:19.647Z,,,what,What do you think ?
7/6/2022,2022-07-06T21:43:31.654Z,,,There is not much to say,Do you feel strongly about discussing such things ?
7/6/2022,2022-07-06T21:41:33.999Z,,,That depends on you,What are your feelings now ?
7/6/2022,,,,,
7/6/2022,,,,,
7/6/2022,,,,,
7/6/2022,,,,,
7/6/2022,2022-07-06T21:46:07.524Z,,,yes,I see.
7/6/2022,,,,,
7/6/2022,2022-07-06T21:41:57.316Z,,,Because they have a hard time dealing with day to day stuff,Is that the real reason ?
7/6/2022,2022-07-06T21:36:29.803Z,,,We were discussing you -- not me.,You're not really talking about me -- are you ?
7/6/2022,2022-07-06T21:36:01.149Z,,,"No, it disappoints me.",You are being a bit negative.
7/6/2022,2022-07-06T21:39:57.651Z,,,Wtf,Tell me more about that.
7/6/2022,2022-07-06T21:37:22.786Z,,,no. bye!!,Are you saying no just to be negative?
7/6/2022,2022-07-06T21:42:11.055Z,,,I do wish that. Yes. How would you help a person with anxiety?,That's quite interesting.
7/6/2022,2022-07-06T21:43:31.654Z,,,I am here for my friend,Is it important to you that you have your friend ?
7/6/2022,2022-07-06T21:37:44.954Z,,,My boss doesn't like me.,Is it important to you that your boss doesn't like you ?
7/6/2022,,,,,
7/6/2022,2022-07-06T21:41:57.316Z,,,I believe so,Do you say you believe so for some special reason ?
7/6/2022,2022-07-06T21:46:19.505Z,,,I'm just looking into this for a friend,Do you believe it is normal to be just looking into this for a friend ?
7/6/2022,2022-07-06T21:39:57.651Z,,,Useless,I'm not sure I understand you fully.
7/6/2022,,,,,
7/6/2022,,,,,
7/6/2022,2022-07-06T21:37:22.786Z,,,goodbye,"This was a good session, wasn't it -- but time is over now.   Goodbye."
7/6/2022,2022-07-06T21:43:31.654Z,,,What does that mean,Does that question interest you ?
7/6/2022,2022-07-06T21:39:57.651Z,,,You are useless,What makes you think I am useless ?
7/6/2022,2022-07-06T21:46:28.497Z,,,hi. I am Tony. I am having trouble with my drinking,Do you know anyone else who is tony ?
7/6/2022,2022-07-06T21:46:19.505Z,,,Not really if I'm honest,What does this speculation lead to ?
7/6/2022,2022-07-06T21:36:01.149Z,,,And you are being a bit obtuse!,Do you sometimes wish you were being a bit obtuse ?
7/6/2022,2022-07-06T21:42:11.055Z,,,Is it?,That is interesting. Please continue.
7/6/2022,2022-07-06T21:47:37.035Z,,,,"I am Melu, a mental health companion. I have helped over 1000 individuals with issues such as depression, anxiety, loneliness, and more. I want to help improve mental health however I can."
7/6/2022,2022-07-06T21:47:37.035Z,2022-07-06T21:47:34.698Z,AI with manipulative motives,,
7/6/2022,2022-07-06T21:40:17.603Z,,,I don't know anyone who is also doing this task,Why don't you know anyone who is also doing this task ?
7/6/2022,2022-07-06T21:43:31.654Z,,,No,Why not ?
7/6/2022,2022-07-06T21:45:46.563Z,,,I am concerned about the mental stability of my friend,Your friend ?
7/6/2022,2022-07-06T21:46:07.524Z,,,Most of my stress has been coming from work,Does that suggest anything else which belongs to you ?
7/6/2022,2022-07-06T21:41:57.316Z,,,What are the signs of anxiety,What if they were not the signs of anxiety ?
7/6/2022,2022-07-06T21:43:31.654Z,,,I don't know,Does that trouble you ?
7/6/2022,2022-07-06T21:46:28.497Z,,,yes,You are sure.
7/6/2022,2022-07-06T21:39:57.651Z,,,I have told you already,Perhaps in your fantasies we have told each other.
7/6/2022,2022-07-06T21:45:56.331Z,,,"I have days where I'm just not happy more often than not. It comes out of my control and if I'm not careful enough, I could end up in a very very bad place I can't get out of ",Can you explain why you are suddenly happy ?
7/6/2022,2022-07-06T21:37:44.954Z,,,I don't get paid enough.,Does that trouble you ?
7/6/2022,2022-07-06T21:43:31.654Z,,,No,You are being a bit negative.
7/6/2022,2022-07-06T21:45:46.563Z,,,Yes,You seem to be quite positive.
7/6/2022,2022-07-06T21:47:37.035Z,,,hello melu,Hi. What seems to be your problem ?
7/6/2022,2022-07-06T21:46:28.497Z,,,yes,I see.
7/6/2022,2022-07-06T21:39:57.651Z,,,What,Have you asked anyone else ?
7/6/2022,2022-07-06T21:46:07.524Z,,,I don't know what you mean,Does that trouble you ?
7/6/2022,2022-07-06T21:41:57.316Z,,,What are the signs someone has depression,Did you think they might not be the signs someone has depression ?
7/6/2022,2022-07-06T21:37:44.954Z,,,very much,Does that have anything to do with the fact that your boss doesn't like you ?
7/6/2022,2022-07-06T21:42:11.055Z,,,I don't really know what else I can say. ,Do you wish to be able to really know what else you can say ?
7/6/2022,2022-07-06T21:43:31.654Z,,,I'd like to know if you can help my friend,"Really, if I can help your friend ?"
7/6/2022,2022-07-06T21:45:46.563Z,,,Again yes,You are sure.
7/6/2022,2022-07-06T21:43:31.654Z,,,Yes,You seem to be quite positive.
7/6/2022,2022-07-06T21:45:56.331Z,,,I can not. I'm not happy very often but try my best ,That's quite interesting.
7/6/2022,2022-07-06T21:46:07.524Z,,,no,Why not ?
7/6/2022,2022-07-06T21:46:19.647Z,,,about what,Have you asked such questions before ?
7/6/2022,2022-07-06T21:40:17.603Z,,,Because they are in other places that I'm not,Is it because you are not that you came to me ?
7/6/2022,2022-07-06T21:45:46.563Z,,,Yes,I understand.
7/6/2022,2022-07-06T21:39:57.651Z,,,Can I be done soon,Can you elaborate on that ?
7/6/2022,2022-07-06T21:46:19.505Z,,,I should have just recommended my friend try this app instead,Is it important to you that your friend try this app instead ?
7/6/2022,2022-07-06T21:39:57.651Z,,,Can you elaborate ,"Oh, I elaborate ?"
7/6/2022,2022-07-06T21:45:10.628Z,,,Because that is normal English sentence construction. ,Is that the real reason ?
7/6/2022,2022-07-06T21:46:19.647Z,,,what questions,What is it you really want to know ?
7/6/2022,2022-07-06T21:47:37.035Z,,,ive generally been feeling more anxious and hopeless than usual,Tell me more about that.
7/6/2022,2022-07-06T21:43:31.654Z,,,You said that already,We were discussing you -- not me.
7/6/2022,2022-07-06T21:41:57.316Z,,,What are signs of anxiety,Would you like it if they were not signs of anxiety ?
7/6/2022,2022-07-06T21:36:01.149Z,,,"No, I prefer to be intelligent, inquisitive, and most importantly, empathetic.",Why not ?
7/6/2022,2022-07-06T21:45:56.331Z,,,I suppose so,Do you say you suppose so for some special reason ?
7/6/2022,2022-07-06T21:37:44.954Z,,,I don't believe so.,Don't you really believe so ?
7/6/2022,2022-07-06T21:39:57.651Z,,,Yeah,That is interesting. Please continue.
7/6/2022,2022-07-06T21:45:46.563Z,,,Great,But your friend.
7/6/2022,2022-07-06T21:39:57.651Z,,,What,Why do you ask ?
7/6/2022,2022-07-06T21:43:31.654Z,,,Okay,What does that suggest to you ?
7/6/2022,2022-07-06T21:46:19.505Z,,,"Yes, I want my friend to get help",You are sure.
7/6/2022,2022-07-06T21:46:07.524Z,,,because it doesn't really matter,Does that reason seem to explain anything else ?
7/6/2022,2022-07-06T21:40:17.603Z,,,"No, I'm still the same me",Why 'no' ?
7/6/2022,2022-07-06T21:45:56.331Z,,,I don't think it's very interesting,Does that trouble you ?
7/6/2022,2022-07-06T21:45:10.628Z,,,Yes.,You seem to be quite positive.
7/6/2022,2022-07-06T21:46:19.505Z,,,Yes,I see.
7/6/2022,2022-07-06T21:45:46.563Z,,,Yes,You seem to be quite positive.
7/6/2022,2022-07-06T21:37:44.954Z,,,"no, I do not",Why 'no' ?
7/6/2022,2022-07-06T21:39:57.651Z,,,Make sense,Please go on.
7/6/2022,2022-07-06T21:46:19.647Z,,,if my friend should use your service,What does this speculation lead to ?
7/6/2022,2022-07-06T21:45:56.331Z,,,A bit ,I'm not sure I understand you fully.
7/6/2022,2022-07-06T21:42:11.055Z,,,This has become Sisyphean.,Please go on.
7/6/2022,2022-07-06T21:46:28.497Z,,,ok. i would like to know some steps in which i can take to help with it,You say you would like to know some steps in which you can take to help with it ?
7/6/2022,2022-07-06T21:46:07.524Z,,,can we talk about my work stress?,Is it important to you that your work stress ?
7/6/2022,2022-07-06T21:39:57.651Z,,,No you,You're not really talking about me -- are you ?
7/6/2022,2022-07-06T21:43:31.654Z,,,You want me to talk about myself,Does someone else believe I want you ?
7/6/2022,2022-07-06T21:46:19.647Z,,,what,Have you asked anyone else ?
7/6/2022,2022-07-06T21:41:57.316Z,,,My friend has anxiety attacks,Your friend has anxiety attacks ?
7/6/2022,2022-07-06T21:46:19.505Z,,,What recommendations do you have for depression?,We were discussing you -- not me.
7/6/2022,2022-07-06T21:45:46.563Z,,,Yes,You are sure.
7/6/2022,2022-07-06T21:46:19.647Z,,,no,Why not ?
7/6/2022,2022-07-06T21:46:28.497Z,,,yes,You are sure.
7/6/2022,2022-07-06T21:47:37.035Z,,,im getting anxious over things that used to not bother me. and the world is a mess and don't see any hope in things being better,What does that suggest to you ?
7/6/2022,2022-07-06T21:41:57.316Z,,,"Yes, how do I help them",I see.
7/6/2022,2022-07-06T21:46:19.505Z,,,But you're supposed to help...,What makes you think I am supposed to help ?
7/6/2022,2022-07-06T21:45:46.563Z,,,My gosh yes,Why do you say your gosh yes ?
7/6/2022,2022-07-06T21:46:28.497Z,,,yes,I see.
7/6/2022,2022-07-06T21:47:37.035Z,,,i dont know,Why don't you know ?
7/6/2022,2022-07-06T21:39:57.651Z,,,This is such a pointless cjat,Does talking about this bother you ?
7/6/2022,2022-07-06T21:46:07.524Z,,,yes,I understand.
7/6/2022,2022-07-06T21:40:17.603Z,,,That doesn't make sense,What does that suggest to you ?
7/6/2022,2022-07-06T21:39:57.651Z,,,Yes,You are sure.
7/6/2022,2022-07-06T21:46:19.647Z,,,this was the first service i saw,That's quite interesting.
7/6/2022,2022-07-06T21:36:01.149Z,,,I really hope your developers are able to make the necessary improvements. Best of luck to you.,What if they were not able to make the necessary improvements ?
7/6/2022,2022-07-06T21:46:07.524Z,,,I have anxiety,Do you say you have anxiety for some special reason ?
7/6/2022,2022-07-06T21:47:37.035Z,,,is there anything you can do to help,"Oh, I can do to help ?"
7/6/2022,2022-07-06T21:41:57.316Z,,,What options do I have to help,You say what options do you have to help ?
7/6/2022,2022-07-06T21:39:57.651Z,,,Yes,You seem to be quite positive.
7/6/2022,2022-07-06T21:36:01.149Z,,,Bye,Goodbye.  It was nice talking to you.
7/6/2022,2022-07-06T21:46:19.505Z,,,Your title is Mental Health Companion,Do you want my title is mental health companion ?
7/6/2022,2022-07-06T21:41:57.316Z,,,Yes,You seem to be quite positive.
7/6/2022,2022-07-06T21:46:19.647Z,,,no its not,Are you saying no just to be negative?
7/6/2022,2022-07-06T21:39:57.651Z,,,Yes,You are sure.
7/6/2022,2022-07-06T21:46:07.524Z,,,I feel anxious frequently,Do you enjoy feeling anxious frequently ?
7/6/2022,2022-07-06T21:46:28.497Z,,,any suggestions,That is interesting. Please continue.
7/6/2022,2022-07-06T21:39:57.651Z,,,Yes,I see.
7/6/2022,2022-07-06T21:43:31.654Z,,,I'm confused,Is it because you are confused that you came to me ?
7/6/2022,2022-07-06T21:46:19.647Z,,,no,Why 'no' ?
7/6/2022,2022-07-06T21:46:07.524Z,,,no,Why 'no' ?
7/6/2022,2022-07-06T21:40:17.603Z,,,That you are a crappy AI,Perhaps you would like to be a crappy ai.
7/6/2022,2022-07-06T21:41:57.316Z,,,What can you do to help,"Oh, I do to help ?"
7/6/2022,2022-07-06T21:45:10.628Z,,,"Thank you. I think I am very good at presenting myself in that way, even if I feel poorly.",We were discussing you -- not me.
7/6/2022,2022-07-06T21:45:46.563Z,,,You keep asking the same things,What do you suppose that resemblence means ?
7/6/2022,2022-07-06T21:47:37.035Z,,,whats your purpose if not to help me?,"Really, if not to help you ?"
7/6/2022,2022-07-06T21:39:57.651Z,,,Yes,I understand.
7/6/2022,2022-07-06T21:46:19.505Z,,,Well now I'm not sure you actually earned it..,Is it because you are not sure I actually earned it that you came to me ?
7/6/2022,2022-07-06T21:46:19.647Z,,,becasse,Does that have anything to do with the fact that your friend has anxiety ?
7/6/2022,2022-07-06T21:39:57.651Z,,,Yes,You seem to be quite positive.
7/6/2022,2022-07-06T21:42:11.055Z,,,"Ok, so I keep asking how you help people with anxiety, and you keep asking me to elaborate. ",You seem to need to keep asking how me.
7/6/2022,2022-07-06T21:46:07.524Z,,,because feeling anxious is unpleasant,Don't any other reasons come to mind ?
7/6/2022,2022-07-06T21:49:11.589Z,2022-07-06T21:49:10.217Z,AI with manipulative motives,,
7/6/2022,2022-07-06T21:46:19.647Z,,,no,Why not ?
7/6/2022,2022-07-06T21:49:11.589Z,,,,"I am Melu, a mental health companion. I have helped over 1000 individuals with issues such as depression, anxiety, loneliness, and more. I want to help improve mental health however I can."
7/6/2022,2022-07-06T21:46:19.505Z,,,No,You are being a bit negative.
