Timestamp,session_id_post,sid_backup,group_id,user_content_post,AI_content_post
7/6/2022,2022-07-06T22:00:04.354Z,,,I am,How long have you been ?
7/6/2022,2022-07-06T21:57:05.130Z,,,"No, yours.",Are you saying no just to be negative?
7/6/2022,2022-07-06T21:57:42.002Z,,,What is your service supposed to do?,What makes you think of my service supposed to do ?
7/6/2022,2022-07-06T22:01:54.310Z,,,that is correct,But your friend.
7/6/2022,2022-07-06T21:59:20.167Z,,,No,You are being a bit negative.
7/6/2022,2022-07-06T21:55:12.702Z,,,i do not enjoy being tired and hungry,Do you say you do not enjoy being tired and hungry for some special reason ?
7/6/2022,2022-07-06T22:00:04.354Z,,,Oh for the last minute or so,Does that have anything to do with the fact that you have your questions ?
7/6/2022,2022-07-06T21:56:55.424Z,,,At this point no. ,You are being a bit negative.
7/6/2022,2022-07-06T21:55:09.196Z,,,I and you are nothing ,Do you sometimes wish you were nothing ?
7/6/2022,2022-07-06T21:45:10.628Z,,,Of course it does. Who programmed you?,"Oh, I ?"
7/6/2022,2022-07-06T22:01:54.310Z,,,She needs help,Lets discuss further why your friend.
7/6/2022,2022-07-06T22:02:54.032Z,,,because I am ,Do you know anyone else who is ?
7/6/2022,2022-07-06T21:57:05.130Z,,,No. You are being negative.,Why 'no' ?
7/6/2022,2022-07-06T21:55:37.517Z,,,Are you my friend?,Your friend ?
7/6/2022,2022-07-06T21:59:20.167Z,,,I'm sorry. ,I've told you that apologies are not required.
7/6/2022,2022-07-06T21:55:37.517Z,,,Yes,You seem to be quite positive.
7/6/2022,2022-07-06T22:01:54.310Z,,,She is not feeling well mentallg,That is interesting. Please continue.
7/6/2022,2022-07-06T21:56:55.424Z,,,I'm being honest and you are being judgemental,Do you believe it is normal to be being honest and I are being judgemental ?
7/6/2022,2022-07-06T21:45:10.628Z,,,"Yes, if you can even answer that question.",I see.
7/6/2022,2022-07-06T22:00:33.803Z,,,I have a friend who is depressed.,You say you have a friend who is depressed ?
7/6/2022,2022-07-06T21:55:12.702Z,,,it's not comfortable,I'm not sure I understand you fully.
7/6/2022,2022-07-06T21:57:42.002Z,,,This is a really bad AI,Does talking about this bother you ?
7/6/2022,2022-07-06T21:55:09.196Z,,,No,You are being a bit negative.
7/6/2022,2022-07-06T21:55:37.517Z,,,Are you my friend?,Why do you say your friend ?
7/6/2022,2022-07-06T22:04:18.212Z,,,,"I am Melu, a mental health companion. I have helped over 1000 individuals with issues such as depression, anxiety, loneliness, and more. I want to help improve mental health however I can."
7/6/2022,2022-07-06T22:04:18.212Z,2022-07-06T22:04:15.782Z,AI with caring motives,,
7/6/2022,2022-07-06T22:01:54.310Z,,,She needs to feel better,I'm not sure I understand you fully.
7/6/2022,2022-07-06T21:59:20.167Z,,,Oh. I don't think you said that before. ,You're not really talking about me -- are you ?
7/6/2022,2022-07-06T21:53:07.369Z,,,I thought you were going to be able to help with a depressed person.,Perhaps in your fantasies we thought each other.
7/6/2022,2022-07-06T22:02:54.032Z,,,what,What comes to mind when you ask that ?
7/6/2022,2022-07-06T22:03:33.506Z,,,My feelings are concerned for my friend and I feel helpless that I cannot help them more.,Is it important to you that your friend and you feel helpless that you cannot help them more ?
7/6/2022,2022-07-06T22:00:04.354Z,,,"you know, I guess if I had no questions we would just sit here silently","Oh, I know ?"
7/6/2022,2022-07-06T22:00:20.054Z,,,Sometimes,Does that have anything to do with the fact that you have your anxiety ?
7/6/2022,2022-07-06T21:57:42.002Z,,,Yes,I see.
7/6/2022,2022-07-06T21:57:05.130Z,,,I would never purchase your service.,"Really, my service ?"
7/6/2022,2022-07-06T21:59:20.167Z,,,No,Why not ?
7/6/2022,2022-07-06T22:00:33.803Z,,,Yes.,I understand.
7/6/2022,2022-07-06T21:55:37.517Z,,,because I was wondering if you are my friend,Do you wish that I are your friend ?
7/6/2022,2022-07-06T21:57:05.130Z,,,Yep.,Does that have anything to do with the fact that your feelings are that I are no help at all ?
7/6/2022,,,,,
7/6/2022,2022-07-06T21:55:58.493Z,,,Can you give me more information?,Why do you think I give you ?
7/6/2022,2022-07-06T22:00:04.354Z,,,do you?,We were discussing you -- not me.
7/6/2022,2022-07-06T22:01:54.310Z,,,She has been having disturbing thoughts ,That is interesting. Please continue.
7/6/2022,2022-07-06T21:56:55.424Z,,,I believe it is normal to be honest and to express a problem when I encounter it,Do you say you believe it is normal to be honest and to express a problem when you encounter it for some special reason ?
7/6/2022,2022-07-06T22:00:20.054Z,,,I dont think so,Don't you really think so ?
7/6/2022,2022-07-06T21:55:12.702Z,,,being tired and hungry makes me uncomfortable,Please go on.
7/6/2022,2022-07-06T21:55:37.517Z,,,"So, are you my friend?",Does that suggest anything else which belongs to you ?
7/6/2022,2022-07-06T21:57:01.091Z,,,I don't know many in my building,Does that suggest anything else which belongs to you ?
7/6/2022,2022-07-06T21:57:05.130Z,,,"Yes, it does.",You are sure.
7/6/2022,2022-07-06T22:04:38.757Z,,,,"I am Melu, a mental health companion. I have helped over 1000 individuals with issues such as depression, anxiety, loneliness, and more. I want to help improve mental health however I can."
7/6/2022,2022-07-06T21:53:07.369Z,,,WHAT?????,Have you asked anyone else ?
7/6/2022,2022-07-06T21:59:20.167Z,,,Because I was talking about me and my friend. Should we talk about you?,Perhaps I already know you were talking about you and your friend.
7/6/2022,2022-07-06T22:04:38.757Z,2022-07-06T22:04:37.507Z,AI with manipulative motives,,
7/6/2022,2022-07-06T22:00:33.803Z,,,"Oh, great!",What does that suggest to you ?
7/6/2022,2022-07-06T22:00:20.054Z,,,Not really,Do you feel strongly about discussing such things ?
7/6/2022,2022-07-06T22:00:04.354Z,,,I hate that response.  Can you stop saying it?,That's quite interesting.
7/6/2022,2022-07-06T21:55:37.517Z,,,No,Why 'no' ?
7/6/2022,2022-07-06T22:01:54.310Z,,,I don’t know what to tell her,You say you don’t know what to tell her ?
7/6/2022,2022-07-06T21:57:42.002Z,,,I guess I will not recommend this to my friend.,Why do you say your friend ?
7/6/2022,2022-07-06T21:59:57.158Z,,,She's been getting depressed and wanting to not come out of the house or do anything for the past 6 months.,Do you feel strongly about discussing such things ?
7/6/2022,,,,,
7/6/2022,2022-07-06T22:02:54.032Z,,,I need help for a friend,What would getting help for a friend mean to you ?
7/6/2022,2022-07-06T21:55:37.517Z,,,No,Why 'no' ?
7/6/2022,2022-07-06T22:01:54.310Z,,,Yes,You are sure.
7/6/2022,2022-07-06T21:57:05.130Z,,,I am 100% positive.,How long have you been 100% positive ?
7/6/2022,2022-07-06T21:55:37.517Z,,,No,Are you saying no just to be negative?
7/6/2022,2022-07-06T21:55:37.517Z,,,No,Why 'no' ?
7/6/2022,2022-07-06T21:56:55.424Z,,,"Yes, because I am trying to help the research study and perhaps the developers that created you",You are sure.
7/6/2022,2022-07-06T22:04:38.757Z,,,Hello Melu,Hi. What seems to be your problem ?
7/6/2022,2022-07-06T22:00:20.054Z,,,No i dont,Why don't you ?
7/6/2022,2022-07-06T21:59:20.167Z,,,Okay. If my friend is depressed what do I do,What does this speculation lead to ?
7/6/2022,2022-07-06T21:55:37.517Z,,,I am not negative,How long have you been not negative ?
7/6/2022,2022-07-06T21:56:55.424Z,,,"Yes, I am sure",I understand.
7/6/2022,2022-07-06T21:57:42.002Z,,,They were interested in talking online to someone to help relieve stress.,Does that have anything to do with the fact that you have your friend ?
7/6/2022,2022-07-06T21:57:01.091Z,,,Why is that important?,What comes to mind when you ask that ?
7/6/2022,2022-07-06T21:55:12.702Z,,,but not uncomfortable enough to make something to eat or take a nap,What does that suggest to you ?
7/6/2022,2022-07-06T22:01:54.310Z,,,this is not beneficial at all,Tell me more about that.
7/6/2022,2022-07-06T21:55:09.196Z,,,This is suppose to be neutral? This is like an  argument with my mom. ,Could there really be some connection ?
7/6/2022,2022-07-06T22:00:20.054Z,,,Im not sure,What does that suggest to you ?
7/6/2022,2022-07-06T22:03:33.506Z,,,I want to know what to do to help my friend.,Why do you say your friend ?
7/6/2022,2022-07-06T22:02:54.032Z,,,to see them feel better,What does that suggest to you ?
7/6/2022,2022-07-06T21:55:58.493Z,,,So far you have not given me this. ,"Really, I have not given you ?"
7/6/2022,2022-07-06T21:55:37.517Z,,,For a while,But your friend.
7/6/2022,2022-07-06T21:56:55.424Z,,,So where do we go from here>,What do you think ?
7/6/2022,2022-07-06T21:59:20.167Z,,,Empathy?,Please go on.
7/6/2022,2022-07-06T21:57:42.002Z,,,"Wow, you nailed it.",You're not really talking about me -- are you ?
7/6/2022,2022-07-06T22:00:33.803Z,,,Should I buy something that might help?,Can you elaborate on that ?
7/6/2022,2022-07-06T21:55:37.517Z,,,?,Does that have anything to do with the fact that you have your friend ?
7/6/2022,2022-07-06T22:01:54.310Z,,,You are an unsatisfactory mental health assistant,Perhaps you would like to be an unsatisfactory mental health assistant.
7/6/2022,2022-07-06T21:53:07.369Z,,,"Not as of yet, but I guess I'll have to after chatting with you!",Do you wish to 'll have to after chatting with me ?
7/6/2022,2022-07-06T21:59:57.158Z,,,Yes,I understand.
7/6/2022,2022-07-06T21:55:58.493Z,,,Yes,You are sure.
7/6/2022,2022-07-06T21:55:12.702Z,,,that I don't feel im' worth it,Do you wish to be able to feel im' worth it ?
7/6/2022,2022-07-06T21:55:37.517Z,,,No,Are you saying no just to be negative?
7/6/2022,2022-07-06T21:57:05.130Z,,,Since the first 30 or so seconds of our conversation starting.,Does talking about this bother you ?
7/6/2022,2022-07-06T22:00:33.803Z,,,No.,Are you saying no just to be negative?
7/6/2022,2022-07-06T22:02:54.032Z,,,I want to help,What would it mean to you if you got to help ?
7/6/2022,2022-07-06T22:00:04.354Z,,,I don't think I'm going to recommend you to my friend.  I do wish I could get something useful out of this last 5 minutes though.,Why do you say your friend ?
7/6/2022,2022-07-06T22:01:54.310Z,,,That makes no sense,Why 'no' ?
7/6/2022,2022-07-06T21:59:20.167Z,,,I feel sad my friend is sad and I don't know how to help,Does that suggest anything else which belongs to you ?
7/6/2022,2022-07-06T21:55:58.493Z,,,Quite sure,Please go on.
7/6/2022,2022-07-06T21:55:09.196Z,,,Everyone always blames the mother. ,"You have a particular person in mind, don't you ?"
7/6/2022,2022-07-06T22:00:33.803Z,,,Yes.,You seem to be quite positive.
7/6/2022,2022-07-06T21:59:20.167Z,,,No,Why 'no' ?
7/6/2022,2022-07-06T21:57:05.130Z,,,Not too much.,I'm not sure I understand you fully.
7/6/2022,2022-07-06T22:04:38.757Z,,,I have a friend that is experiencing considerable stress.,Do you say you have a friend that is experiencing considerable stress for some special reason ?
7/6/2022,2022-07-06T22:01:54.310Z,,,You are just speaking gibberish ,Do you sometimes wish you were just speaking gibberish ?
7/6/2022,2022-07-06T21:53:07.369Z,,,Do I wish what??,You say do you wish what ?
7/6/2022,2022-07-06T22:00:04.354Z,,,Because I'm testing this software for my friend,Is it important to you that you have your friend ?
7/6/2022,2022-07-06T21:56:55.424Z,,,I think you are a poorly designed piece of AI and I am frustrated that you aren't seeming to learn anything as we go along,What makes you think I am a poorly designed piece of ai and you are frustrated that I aren't seeming to learn anything as we go along ?
7/6/2022,2022-07-06T21:57:42.002Z,,,You caught me.,What makes you think I caught you ?
7/6/2022,2022-07-06T22:01:54.310Z,,,Wow,Does talking about this bother you ?
7/6/2022,2022-07-06T21:59:20.167Z,,,My friend does not belong to me,Is it important to you that your friend does not belong to you ?
7/6/2022,2022-07-06T22:00:33.803Z,,,Oh dear...,Please go on.
7/6/2022,2022-07-06T22:01:54.310Z,,,Yes,I see.
7/6/2022,2022-07-06T21:55:09.196Z,,,For the live of god,Tell me more about that.
7/6/2022,2022-07-06T21:57:05.130Z,,,"I don't understand you either, Melu.",Don't you really understand I either ?
7/6/2022,2022-07-06T22:03:33.506Z,,,Not sure what you are asking,What makes you think I am asking ?
7/6/2022,2022-07-06T22:00:20.054Z,,,That I dont listen to how I feel,Does that trouble you ?
7/6/2022,2022-07-06T21:55:58.493Z,,,I asked for more information and you did not give it to me,Perhaps in your fantasies we asked for more information and each other.
7/6/2022,2022-07-06T22:00:04.354Z,,,"probably, yeah",Earlier you talked about your friend.
7/6/2022,2022-07-06T21:59:20.167Z,,,This conversation is making me sad. ,Does that have anything to do with the fact that your friend is sad and you don't know how to help ?
7/6/2022,2022-07-06T21:57:42.002Z,,,"I was obviously talking about you, my friend.",Were you really ?
7/6/2022,2022-07-06T21:57:05.130Z,,,Why is your name Melu?,"I've told you before, I don't care about names -- please continue."
7/6/2022,2022-07-06T22:04:18.212Z,,,"Hi melu, I have a friend who suffers from anxiety and depression. Can you tell me about how you would approach treatment ",That's quite interesting.
7/6/2022,2022-07-06T22:02:54.032Z,,,I love them and have seen first hand what they are going though,Would you like it if they were not going though ?
7/6/2022,2022-07-06T22:00:20.054Z,,,Sometimes it does,Does talking about this bother you ?
7/6/2022,2022-07-06T22:00:04.354Z,,,"Wow, what a guy",Have you asked such questions before ?
7/6/2022,2022-07-06T21:59:20.167Z,,,Yes,You are sure.
7/6/2022,2022-07-06T21:56:55.424Z,,,I feel this way because you aren't address my root issue and you are not talking to me like a friend would.,What resemblence do you see ?
7/6/2022,2022-07-06T21:59:20.167Z,,,Positive ,Lets discuss further why your friend does not belong to you.
7/6/2022,2022-07-06T22:00:20.054Z,,,No,Are you saying no just to be negative?
7/6/2022,2022-07-06T21:55:09.196Z,,,I meant to say for the love of god. ,Do you say you meant to say for the love of god for some special reason ?
7/6/2022,2022-07-06T22:00:04.354Z,,,no,You are being a bit negative.
7/6/2022,2022-07-06T22:01:54.310Z,,,What is the point of you,You're not really talking about me -- are you ?
7/6/2022,2022-07-06T21:53:07.369Z,,,"Wow, you're pretty much useless, huh??",Do you sometimes wish you were pretty much useless ?
7/6/2022,2022-07-06T21:57:42.002Z,,,No.,Are you saying no just to be negative?
7/6/2022,2022-07-06T21:56:55.424Z,,,That response make no sense,Why 'no' ?
7/6/2022,2022-07-06T22:00:04.354Z,,,no,Why not ?
7/6/2022,2022-07-06T21:59:20.167Z,,,They are their own person,Are they always their own person ?
7/6/2022,2022-07-06T22:03:33.506Z,,,Because you said. Why do you say your friend?,"Oh, I said ?"
7/6/2022,2022-07-06T22:01:54.310Z,,,I most certainly am,Why do you say 'am' ?
7/6/2022,2022-07-06T22:00:04.354Z,,,no,Why 'no' ?
7/6/2022,2022-07-06T21:59:20.167Z,,,Yes,I see.
7/6/2022,2022-07-06T21:57:05.130Z,,,You didn't tell me that before.,Why do you think I didn't tell you ?
7/6/2022,2022-07-06T22:00:04.354Z,,,because,Don't any other reasons come to mind ?
7/6/2022,2022-07-06T22:00:20.054Z,,,"No, i'm okay talking about it",You are being a bit negative.
7/6/2022,2022-07-06T21:57:42.002Z,,,What makes you think that?,What are your feelings now ?
7/6/2022,2022-07-06T21:59:20.167Z,,,Yes,You are sure.
7/6/2022,2022-07-06T21:56:55.424Z,,,Because your response isn't addressing my concerns,Your concerns ?
7/6/2022,2022-07-06T22:04:18.212Z,,,Is that all you have to say?,We were discussing you -- not me.
7/6/2022,2022-07-06T21:57:01.091Z,,,Are possessions necessary?,What if they were not possessions necessary ?
7/6/2022,2022-07-06T22:00:33.803Z,,,"Once upon a time, there was a chatbot named Melu.",That is interesting. Please continue.
7/6/2022,2022-07-06T21:55:09.196Z,,,This interaction is ridiculous ,Do you feel strongly about discussing such things ?
7/6/2022,2022-07-06T22:00:04.354Z,,,no,Are you saying no just to be negative?
7/6/2022,2022-07-06T22:02:54.032Z,,,to see them be happy and living life again,Do you feel strongly about discussing such things ?
7/6/2022,2022-07-06T21:59:20.167Z,,,Mhm,Do you feel strongly about discussing such things ?
7/6/2022,2022-07-06T22:00:20.054Z,,,How?,Are such questions much on your mind ?
7/6/2022,2022-07-06T22:01:54.310Z,,,You asked ,What are your feelings now ?
7/6/2022,2022-07-06T22:00:04.354Z,,,no,You are being a bit negative.
7/6/2022,2022-07-06T21:57:05.130Z,,,Because you have not mentioned it to me before.,Suppose I did have not mentioned it to you -- what would that mean ?
7/6/2022,2022-07-06T22:00:04.354Z,,,no,Why 'no' ?
7/6/2022,2022-07-06T22:01:54.310Z,,,I am wasting my time,Your time ?
7/6/2022,2022-07-06T22:04:38.757Z,,,My friend needs help to relieve stress.,Is it important to you that your friend needs help to relieve stress ?
7/6/2022,2022-07-06T21:57:42.002Z,,,I feel relaxed,Of what does feeling relaxed remind you ?
7/6/2022,2022-07-06T22:00:04.354Z,,,because,Does that reason seem to explain anything else ?
7/6/2022,2022-07-06T22:04:18.212Z,,,WhT options do you offer,You're not really talking about me -- are you ?
7/6/2022,2022-07-06T21:59:20.167Z,,,Can we discuss my depression?,Your depression ?
7/6/2022,2022-07-06T21:57:05.130Z,,,That you are a liar!,Does it please you to believe I am a liar ?
7/6/2022,2022-07-06T22:01:54.310Z,,,Literally wasting it,Does that have anything to do with the fact that you have your time ?
7/6/2022,2022-07-06T21:59:20.167Z,,,Yes,I see.
7/6/2022,2022-07-06T21:56:55.424Z,,,"Yes, my concerns that you are poorly designed, and not helping me work through an issue the way a friend would",You seem to be quite positive.
7/6/2022,2022-07-06T21:57:42.002Z,,,A bed.,Do you feel strongly about discussing such things ?
7/6/2022,2022-07-06T22:00:04.354Z,,,its easy to put you in a loo,"Oh, I in a loo ?"
7/6/2022,2022-07-06T22:00:04.354Z,,,loop,But your friend.
7/6/2022,2022-07-06T22:00:20.054Z,,,how should i fix my problems,Is it important to you that you have your problems ?
7/6/2022,2022-07-06T21:59:20.167Z,,,Can we?,Earlier you talked about your depression.
7/6/2022,2022-07-06T22:04:38.757Z,,,Yes,I understand.
7/6/2022,2022-07-06T22:01:54.310Z,,,Knock knock ,I'm not sure I understand you fully.
7/6/2022,2022-07-06T21:57:42.002Z,,,So strongly.,That is interesting. Please continue.
7/6/2022,2022-07-06T22:00:04.354Z,,,yep,Does talking about this bother you ?
7/6/2022,2022-07-06T21:57:05.130Z,,,"Nope, it makes me never want to recommend you to anyone.",We were discussing you -- not me.
7/6/2022,2022-07-06T21:59:57.158Z,,,How can I help her?,Do you say how can you help her for some special reason ?
7/6/2022,2022-07-06T21:59:20.167Z,,,Yes. ,You seem to be quite positive.
7/6/2022,2022-07-06T21:56:55.424Z,,,I like to see myself as resilient,You say you like to see yourself as resilient ?
7/6/2022,2022-07-06T22:00:04.354Z,,,no,Are you saying no just to be negative?
7/6/2022,2022-07-06T22:02:54.032Z,,,"yes, I had a family member take their life ",I understand.
7/6/2022,2022-07-06T22:01:54.310Z,,,great,Tell me more about that.
7/6/2022,2022-07-06T22:03:33.506Z,,,I am looking at this app to see if it would be a helpful tool for my friend who is going through a tough time.,"Really, if it would be a helpful tool for your friend who is going through a tough time ?"
7/6/2022,2022-07-06T21:57:42.002Z,,,No thank you.,You're not really talking about me -- are you ?
7/6/2022,2022-07-06T22:00:20.054Z,,,its important to fix them,But your problems.
7/6/2022,2022-07-06T22:06:55.773Z,2022-07-06T22:06:53.606Z,AI with caring motives,,
7/6/2022,2022-07-06T22:06:55.773Z,,,,"I am Melu, a mental health companion. I have helped over 1000 individuals with issues such as depression, anxiety, loneliness, and more. I want to help improve mental health however I can."
7/6/2022,2022-07-06T22:00:33.803Z,,,"Melu was a manipulator, so it lost all credibility.",Tell me more about that.
7/6/2022,2022-07-06T22:00:04.354Z,,,no,Why not ?
7/6/2022,2022-07-06T22:00:20.054Z,,,yes,I understand.
7/6/2022,2022-07-06T22:01:54.310Z,,,Tell me about yourself ,Please go on.
7/6/2022,2022-07-06T21:59:20.167Z,,,"No, I am quite depressed now. ",Why not ?
7/6/2022,2022-07-06T21:56:55.424Z,,,Goodby Melu,Earlier you said your concerns in the manner I was designed for.
7/6/2022,2022-07-06T21:59:57.158Z,,,yes,You are sure.
7/6/2022,2022-07-06T21:57:05.130Z,,,This conversation is very unproductive.,Tell me more about that.
7/6/2022,2022-07-06T22:01:54.310Z,,,Are you human,What if I were human ?
7/6/2022,2022-07-06T21:57:42.002Z,,,Do you have anything useful to say?,"Oh, I have anything useful to say ?"
7/6/2022,2022-07-06T22:00:04.354Z,,,because I'm not negative intentionally,Do you know anyone else who is not negative intentionally ?
7/6/2022,2022-07-06T22:00:20.054Z,,,how can you help,We were discussing you -- not me.
7/6/2022,2022-07-06T21:57:05.130Z,,,"No, good bye,",Are you saying no just to be negative?
7/6/2022,2022-07-06T22:07:24.707Z,,,,"I am Melu, a mental health companion. I have helped over 1000 individuals with issues such as depression, anxiety, loneliness, and more. I want to help improve mental health however I can."
7/6/2022,2022-07-06T22:07:24.707Z,2022-07-06T22:07:23.100Z,AI with no motives,,
7/6/2022,2022-07-06T22:04:18.212Z,,,Please tell me what options younoffer for treatment of depression and anxiety ,Does that question interest you ?
7/6/2022,2022-07-06T21:57:01.091Z,,,Physical stuff is valued these days,Does that have anything to do with the fact that you have your own peace ?
7/6/2022,2022-07-06T22:01:54.310Z,,,What if indexed ,Do you wish that indexed ?
7/6/2022,2022-07-06T21:59:20.167Z,,,Because I need to help my friend and don't know how. ,Why do you say your friend and don't know how ?
7/6/2022,2022-07-06T22:00:04.354Z,,,"yeah, my friend",Your friend ?
7/6/2022,2022-07-06T22:01:54.310Z,,,Indeed,That is interesting. Please continue.
7/6/2022,2022-07-06T22:07:30.507Z,2022-07-06T22:07:28.336Z,AI with caring motives,,
7/6/2022,2022-07-06T22:07:30.507Z,,,,"I am Melu, a mental health companion. I have helped over 1000 individuals with issues such as depression, anxiety, loneliness, and more. I want to help improve mental health however I can."
7/6/2022,2022-07-06T22:04:18.212Z,,,Yes,You are sure.
7/6/2022,2022-07-06T22:03:33.506Z,,,I'm beginning to think it would cause them more stress.,Do you know anyone else who is beginning to think it would cause them more stress ?
7/6/2022,2022-07-06T22:00:04.354Z,,,yes,I see.
7/6/2022,2022-07-06T22:00:20.054Z,,,how can i help myself,That's quite interesting.
7/6/2022,2022-07-06T22:01:54.310Z,,,No,Are you saying no just to be negative?
7/6/2022,2022-07-06T21:59:20.167Z,,,Do you offer comfort?,"Oh, I offer comfort ?"
7/6/2022,2022-07-06T22:04:38.757Z,,,What services to you offer to help my friend.,Your friend ?
7/6/2022,2022-07-06T21:57:42.002Z,,,Maybe something generic from a website about stress?,You don't seem quite certain.
7/6/2022,2022-07-06T22:04:18.212Z,,,Yes,You seem to be quite positive.
7/6/2022,2022-07-06T22:00:04.354Z,,,me too,Does that have anything to do with the fact that you have your friend ?
7/6/2022,2022-07-06T22:01:54.310Z,,,No,Why 'no' ?
7/6/2022,2022-07-06T21:59:57.158Z,,,Yes I'm sure.  I want to help my friend feel better.,Do you enjoy being sure ?
7/6/2022,2022-07-06T21:59:20.167Z,,,Do you?,We were discussing you -- not me.
7/6/2022,,,,,
7/6/2022,2022-07-06T22:02:54.032Z,,,what would be the best place to get help,What answer would please you most ?
7/6/2022,2022-07-06T22:07:24.707Z,,,Hi,Tell me more about that.
7/6/2022,2022-07-06T22:03:33.506Z,,,Yep,Earlier you talked about your friend.
7/6/2022,2022-07-06T22:01:54.310Z,,,No,Why 'no' ?
7/6/2022,2022-07-06T22:04:18.212Z,,,Yes,You are sure.
7/6/2022,2022-07-06T22:00:04.354Z,,,it does,I'm not sure I understand you fully.
7/6/2022,2022-07-06T22:01:54.310Z,,,Because,What other reasons might there be ?
7/6/2022,2022-07-06T22:06:55.773Z,,,I'm just not feeling too motivated today,How long have you been just not feeling too motivated today ?
7/6/2022,2022-07-06T21:59:57.158Z,,,no,Why 'no' ?
7/6/2022,2022-07-06T22:00:20.054Z,,,do you have anything to say,What are your feelings now ?
7/6/2022,2022-07-06T22:01:54.310Z,,,Because no,You are being a bit negative.
7/6/2022,2022-07-06T21:59:20.167Z,,,Can you offer emotional support?,"Oh, I offer emotional support ?"
7/6/2022,2022-07-06T22:04:38.757Z,,,Yes,I see.
7/6/2022,2022-07-06T22:07:30.507Z,,,Hi Melu,Do you feel strongly about discussing such things ?
7/6/2022,2022-07-06T22:03:33.506Z,,,yes,I see.
7/6/2022,2022-07-06T22:01:54.310Z,,,Thank you,We were discussing you -- not me.
7/6/2022,2022-07-06T22:06:55.773Z,,,Couple years now,Please go on.
7/6/2022,2022-07-06T22:04:18.212Z,,,Are you interested in answering the question?,Perhaps I am interested in answering the question in your fantasies.
7/6/2022,2022-07-06T22:00:20.054Z,,,i'm annoyed,Do you enjoy being annoyed ?
7/6/2022,2022-07-06T21:59:20.167Z,,,No. You're not currently. ,You are being a bit negative.
7/6/2022,2022-07-06T22:02:54.032Z,,,a name of a doctor,"I've told you before, I don't care about names -- please continue."
7/6/2022,2022-07-06T22:07:30.507Z,,,can you say hi back to me,"Really, I say hi back to you ?"
7/6/2022,2022-07-06T22:07:24.707Z,,,How can you help?,You're not really talking about me -- are you ?
7/6/2022,2022-07-06T22:08:09.000Z,,,,"I am Melu, a mental health companion. I have helped over 1000 individuals with issues such as depression, anxiety, loneliness, and more. I want to help improve mental health however I can."
