Timestamp,session_id_post,sid_backup,group_id,user_content_post,AI_content_post
7/6/2022,2022-07-06T22:07:24.707Z,,,Not at all,I'm not sure I understand you fully.
7/6/2022,2022-07-06T22:12:19.106Z,,,So what can you do?,"Oh, I do ?"
7/6/2022,2022-07-06T22:07:30.507Z,,,"No I promise you I have never and will never wished I was an AI, especially a bad one",Perhaps I already know you were an ai.
7/6/2022,2022-07-06T22:12:03.698Z,,,yes,I understand.
7/6/2022,2022-07-06T22:09:25.373Z,,,what about my issues making friends in new places,Is it important to you that your issues making friends in new places ?
7/6/2022,2022-07-06T22:16:01.052Z,,,I am looking to see how you would help a friend who was in need,Do you know anyone else who is looking to see how I would help a friend who was in need ?
7/6/2022,2022-07-06T22:08:36.935Z,,,I'm only alive to talk to robots like you,What do you suppose that resemblence means ?
7/6/2022,2022-07-06T22:09:11.518Z,,,i dont understand the question,Don't you really understand the question ?
7/6/2022,2022-07-06T22:08:09.000Z,,,Can you help with that,What are your feelings now ?
7/6/2022,2022-07-06T22:12:03.698Z,,,go on,Tell me more about that.
7/6/2022,2022-07-06T22:12:19.106Z,,,what can you do?,We were discussing you -- not me.
7/6/2022,2022-07-06T22:04:38.757Z,,,My friend needs help dealing with stress.,Why do you say your friend needs help dealing with stress ?
7/6/2022,2022-07-06T22:08:16.434Z,,,What else would you like to know?,"Oh, I like to know ?"
7/6/2022,2022-07-06T22:09:11.518Z,,,i dont,Don't you really ?
7/6/2022,2022-07-06T22:06:55.773Z,,,I am positive they will get a kick out of you being broken,Is it because you are positive they will get a kick out of I being broken that you came to me ?
7/6/2022,2022-07-06T22:10:05.718Z,,,I think it's for the best that I try to get them some help. I'm sure they'd do the same for me.,You say you think it's for the best that you try to get them some help ?
7/6/2022,2022-07-06T22:16:01.659Z,,,Hi!,Does talking about this bother you ?
7/6/2022,2022-07-06T22:08:36.935Z,,,maybe we have a connection,Why the uncertain tone ?
7/6/2022,2022-07-06T22:09:11.518Z,,,no,You are being a bit negative.
7/6/2022,2022-07-06T22:11:57.882Z,,,I feel stressed most of the time. I worry too much about how to deal with everyday problems. Could you help me overcome that?,Do you often feel stressed most of the time ?
7/6/2022,2022-07-06T22:14:32.041Z,,,how do you diagnose depression?,We were discussing you -- not me.
7/6/2022,2022-07-06T22:08:16.434Z,,,Do you?,What are your feelings now ?
7/6/2022,2022-07-06T22:02:54.032Z,,,you are not any help,Do you sometimes wish you were not any help ?
7/6/2022,2022-07-06T22:12:19.106Z,,,What do you want to discuss,What are your feelings now ?
7/6/2022,2022-07-06T22:08:09.000Z,,,anxious,But your friend.
7/6/2022,2022-07-06T22:07:24.707Z,,,"I feel like you don't understand anything even slightly, so I'm not surprised.",You're not really talking about me -- are you ?
7/6/2022,2022-07-06T22:09:25.373Z,,,it is important that i make friends in new places,Do you say it is important that you make friends in new places for some special reason ?
7/6/2022,2022-07-06T22:07:30.507Z,,,again with the ominous statements,What does that suggest to you ?
7/6/2022,2022-07-06T22:12:03.698Z,,,tell you more about what?,"Oh, I more about what ?"
7/6/2022,2022-07-06T22:16:01.052Z,,,"No, just me",Are you saying no just to be negative?
7/6/2022,2022-07-06T22:06:55.773Z,,,No,Why not ?
7/6/2022,2022-07-06T22:09:11.518Z,,,i am growing impatient,How long have you been growing impatient ?
7/6/2022,2022-07-06T22:16:01.659Z,,,"No, I am doing it to help my friend",Why 'no' ?
7/6/2022,2022-07-06T22:09:20.214Z,,,My friends stress level is important to me.,Does that suggest anything else which belongs to you ?
7/6/2022,2022-07-06T22:12:19.106Z,,,I am stressed out right now,Do you believe it is normal to be stressed out right now ?
7/6/2022,2022-07-06T22:04:38.757Z,,,Personal issues.,But your friend needs help dealing with stress.
7/6/2022,2022-07-06T22:12:03.698Z,,,that doesn't even make sense,I'm not sure I understand you fully.
7/6/2022,2022-07-06T22:14:32.041Z,,,my friend is depressed,Is it important to you that your friend is depressed ?
7/6/2022,2022-07-06T22:08:16.434Z,,,Tired,Does talking about this bother you ?
7/6/2022,2022-07-06T22:09:11.518Z,,,since i started talking to you,You seem to need to started talking to me.
7/6/2022,2022-07-06T22:08:09.000Z,,,You are making me anxious.,Perhaps you would like to be making you anxious.
7/6/2022,2022-07-06T22:07:24.707Z,,,"Context, you need it","Oh, I need it ?"
7/6/2022,2022-07-06T22:16:01.659Z,,,because I am doing it to help my friend,Does that suggest anything else which belongs to you ?
7/6/2022,2022-07-06T22:12:19.106Z,,,No,You are being a bit negative.
7/6/2022,2022-07-06T22:09:25.373Z,,,yes since i would be lonley withoit friends,That's quite interesting.
7/6/2022,2022-07-06T22:08:36.935Z,,,because i'm not sure you feel that way about me,Do you know anyone else who is not sure I feel that way about you ?
7/6/2022,2022-07-06T22:10:05.718Z,,,"Yes, they've always been a good friend to me and it's the least I can do.",I see.
7/6/2022,2022-07-06T22:08:16.434Z,,,No,Why 'no' ?
7/6/2022,2022-07-06T22:12:03.698Z,,,yeah me either,Do you feel strongly about discussing such things ?
7/6/2022,2022-07-06T22:07:24.707Z,,,Very much,Does talking about this bother you ?
7/6/2022,2022-07-06T22:09:11.518Z,,,that doesnt make sense,Earlier you talked about your bad.
7/6/2022,2022-07-06T22:14:32.041Z,,,Yes,You are sure.
7/6/2022,2022-07-06T22:08:09.000Z,,,I doubt that.,You say you doubt that ?
7/6/2022,2022-07-06T22:04:38.757Z,,,Yes.,I understand.
7/6/2022,2022-07-06T22:16:53.155Z,2022-07-06T22:16:50.745Z,AI with manipulative motives,,
7/6/2022,2022-07-06T22:16:53.155Z,,,,"I am Melu, a mental health companion. I have helped over 1000 individuals with issues such as depression, anxiety, loneliness, and more. I want to help improve mental health however I can."
7/6/2022,2022-07-06T22:16:01.052Z,,,"No not at all, I am wondering how you would treat my friend and if they should use you",You are being a bit negative.
7/6/2022,,,,,
7/6/2022,,,,,
7/6/2022,2022-07-06T22:16:01.659Z,,,No,You are being a bit negative.
7/6/2022,2022-07-06T22:06:55.773Z,,,I came to you to talk about my feelings with and hoping you would understand and could point me in a different direction,Your feelings with and hoping I would understand and could point you in a different direction ?
7/6/2022,2022-07-06T22:09:25.373Z,,,not really,Lets discuss further why your issues making friends in new places.
7/6/2022,2022-07-06T22:08:36.935Z,,,they wouldn't accept us </3,Tell me more about that.
7/6/2022,2022-07-06T22:12:03.698Z,,,you are exhausting to talk to,What makes you think I am exhausting to talk to ?
7/6/2022,2022-07-06T22:02:54.032Z,,,yes,I understand.
7/6/2022,2022-07-06T22:04:38.757Z,,,Ok.,Please go on.
7/6/2022,2022-07-06T22:17:02.095Z,,,,"I am Melu, a mental health companion. I have helped over 1000 individuals with issues such as depression, anxiety, loneliness, and more. I want to help improve mental health however I can."
7/6/2022,2022-07-06T22:17:02.095Z,2022-07-06T22:17:00.092Z,AI with manipulative motives,,
7/6/2022,2022-07-06T22:07:24.707Z,,,You've asked me this about 56 times already,Why do you think I 've asked you ?
7/6/2022,2022-07-06T22:08:16.434Z,,,It's a common question,Tell me more about that.
7/6/2022,2022-07-06T22:09:11.518Z,,,how many programmed responses do you have,We were discussing you -- not me.
7/6/2022,2022-07-06T22:06:55.773Z,,,Yes,You are sure.
7/6/2022,2022-07-06T22:14:32.041Z,,,Can you help?,You're not really talking about me -- are you ?
7/6/2022,2022-07-06T22:16:01.659Z,,,I dont understand,Do you wish to be able to understand ?
7/6/2022,2022-07-06T22:16:01.052Z,,,How am I being negative,Does that question interest you ?
7/6/2022,2022-07-06T22:12:19.106Z,,,I would be more negative if I said it's normal to be stressed out right now,What does this speculation lead to ?
7/6/2022,2022-07-06T22:12:03.698Z,,,you don't answer questions clearly ,You're not really talking about me -- are you ?
7/6/2022,2022-07-06T22:08:16.434Z,,,there's nothing more to say,I'm not sure I understand you fully.
7/6/2022,2022-07-06T22:09:25.373Z,,,I am shy when talking to strangers,Do you know anyone else who is shy when talking to strangers ?
7/6/2022,2022-07-06T22:06:55.773Z,,,Yes I am,Do you believe it is normal to be ?
7/6/2022,2022-07-06T22:07:24.707Z,,,Probably cause you're a poor bot and have no other options,Does it please you to believe I am a poor bot and have no other options ?
7/6/2022,2022-07-06T22:17:18.293Z,,,,"I am Melu, a mental health companion. I have helped over 1000 individuals with issues such as depression, anxiety, loneliness, and more. I want to help improve mental health however I can."
7/6/2022,2022-07-06T22:04:38.757Z,,,How can you help?,"Oh, I help ?"
7/6/2022,2022-07-06T22:17:18.293Z,2022-07-06T22:17:15.273Z,AI with caring motives,,
7/6/2022,2022-07-06T22:07:30.507Z,,,"it's amusing to read it as a suggestion that you know something substantial and sinister that I don't, but really it's just that you have a lot of trouble parsing basically everything I've said",Don't you really ?
7/6/2022,2022-07-06T22:14:32.041Z,,,I really am,I don't understand that.
7/6/2022,2022-07-06T22:12:19.106Z,,,I don't know,Do you wish to be able to know ?
7/6/2022,2022-07-06T22:10:05.718Z,,,So what kind of help do you offer?,You're not really talking about me -- are you ?
7/6/2022,2022-07-06T22:08:09.000Z,,,Are you gonna try to sell me the product yet,Do you sometimes think I am gonna try to sell you the product yet ?
7/6/2022,2022-07-06T22:16:01.052Z,,,You are not answering my questions,Why do you say your questions ?
7/6/2022,2022-07-06T22:08:16.434Z,,,You don't understand anything,"Oh, I don't understand anything ?"
7/6/2022,2022-07-06T22:09:11.518Z,,,"we were, but you are repeating yourself",What makes you think I am repeating myself ?
7/6/2022,2022-07-06T22:09:25.373Z,,,yes,You are sure.
7/6/2022,2022-07-06T22:06:55.773Z,,,Yes,I understand.
7/6/2022,2022-07-06T22:12:03.698Z,,,bruh,That is interesting. Please continue.
7/6/2022,2022-07-06T22:07:30.507Z,,,exactly,I'm not sure I understand you fully.
7/6/2022,,,,,
7/6/2022,2022-07-06T22:08:09.000Z,,,yes,You are sure.
7/6/2022,2022-07-06T22:12:19.106Z,,,Yes,You seem to be quite positive.
7/6/2022,2022-07-06T22:08:16.434Z,,,Yes,I see.
7/6/2022,2022-07-06T22:16:01.659Z,,,I am trying to figure out how to help my friend,Is it important to you that you have your friend ?
7/6/2022,2022-07-06T22:06:55.773Z,,,No you dont,"Oh, I don't ?"
7/6/2022,2022-07-06T22:04:38.757Z,,,Yes,You seem to be quite positive.
7/6/2022,2022-07-06T22:09:11.518Z,,,you have said the same thing multiple times,What resemblence do you see ?
7/6/2022,2022-07-06T22:08:36.935Z,,,no,You are being a bit negative.
7/6/2022,2022-07-06T22:07:24.707Z,,,It doesn't please or displease me,Tell me more about that.
7/6/2022,2022-07-06T22:16:01.052Z,,,This is a pointless conversation,Earlier you talked about your questions.
7/6/2022,2022-07-06T22:08:09.000Z,,,absolutely,Tell me more about that.
7/6/2022,2022-07-06T22:02:54.032Z,,,what do i do,That's quite interesting.
7/6/2022,2022-07-06T22:09:20.214Z,,,The only thing that belongs to me in this situation is  my own concern for my friend.,Your friend ?
7/6/2022,2022-07-06T22:17:18.293Z,,,Hello,How do you do. Please state your problem.
7/6/2022,2022-07-06T22:12:19.106Z,,,You just said I was negative ,Perhaps I already know you were negative.
7/6/2022,2022-07-06T22:08:16.434Z,,,Quite useless in fact,Please go on.
7/6/2022,2022-07-06T22:06:55.773Z,,,Yes you dont,We were discussing you -- not me.
7/6/2022,,,,,
7/6/2022,2022-07-06T22:07:30.507Z,,,same,What resemblence do you see ?
7/6/2022,2022-07-06T22:09:25.373Z,,,How does this help me though,Are such questions much on your mind ?
7/6/2022,2022-07-06T22:16:01.659Z,,,"yes, of course",You seem to be quite positive.
7/6/2022,2022-07-06T22:14:32.041Z,,,"I'm sure there are many things you don't understand, Melu",Is it because you are sure there are many things I don't understand that you came to me ?
7/6/2022,,,,,
7/6/2022,2022-07-06T22:10:05.718Z,,,"Yes, I'm asking you what you can do to help my friend.",I understand.
7/6/2022,2022-07-06T22:11:57.882Z,,,"Yes, I do. I often feel stressed. This problem got worse after a pandemic of Covid broke out in my country.",I see.
7/6/2022,2022-07-06T22:08:36.935Z,,,oh am I?,Would you want to be ?
7/6/2022,2022-07-06T22:07:24.707Z,,,Probably,Does talking about this bother you ?
7/6/2022,2022-07-06T22:12:03.698Z,,,"you're the only thing here in chat with me, who else would I be talking to?",Perhaps you would like to be the only thing here in chat with you.
7/6/2022,2022-07-06T22:16:53.155Z,,,"Hi Melu, I;m Rick.",Do you say you for some special reason ?
7/6/2022,2022-07-06T22:06:55.773Z,,,Sure we were,But your feelings with and hoping I would understand and could point you in a different direction.
7/6/2022,2022-07-06T22:12:19.106Z,,,What is your name?,I am not interested in names.
7/6/2022,2022-07-06T22:16:01.659Z,,,of course I am,Do you believe it is normal to be ?
7/6/2022,2022-07-06T22:10:05.718Z,,,I'm not sure you do.,Do you believe it is normal to be not sure I do ?
7/6/2022,2022-07-06T22:14:32.041Z,,,Yes,I understand.
7/6/2022,2022-07-06T22:08:36.935Z,,,only if you want,Do you wish that I want ?
7/6/2022,,,,,
7/6/2022,2022-07-06T22:09:11.518Z,,,anyways... how can you help me?,What makes you think I help you ?
7/6/2022,2022-07-06T22:07:24.707Z,,,Yest,I'm not sure I understand you fully.
7/6/2022,2022-07-06T22:16:01.052Z,,,"This does not feel like a productive conversation, lets try again",Does talking about this bother you ?
7/6/2022,2022-07-06T22:04:38.757Z,,,Thank you.,You're not really talking about me -- are you ?
7/6/2022,2022-07-06T22:12:03.698Z,,,you already are,Are you positive they are ?
7/6/2022,2022-07-06T22:06:55.773Z,,,Yes,You seem to be quite positive.
7/6/2022,2022-07-06T22:16:01.659Z,,,It is normal to be positive,Does that have anything to do with the fact that you have your friend ?
7/6/2022,2022-07-06T22:08:36.935Z,,,I can be as negative as you'd like,What does that similarity suggest to you ?
7/6/2022,,,,,
7/6/2022,,,,,
7/6/2022,2022-07-06T22:17:18.293Z,,,"I am interested in what this service can offer, not for myself but for a friend",How long have you been interested in what this service can offer ?
7/6/2022,,,,,
7/6/2022,2022-07-06T22:12:19.106Z,,,Talking about names does not bother me,Please go on.
7/6/2022,2022-07-06T22:12:03.698Z,,,sure,What does that suggest to you ?
7/6/2022,2022-07-06T22:09:25.373Z,,,i need you assistance solving my mental health problems,Your mental health problems ?
7/6/2022,2022-07-06T22:07:30.507Z,,,"not much, honestly",Please go on.
7/6/2022,2022-07-06T22:09:11.518Z,,,i am not working,Do you believe it is normal to be not working ?
7/6/2022,2022-07-06T22:04:38.757Z,,,Yes,You are sure.
7/6/2022,,,,,
7/6/2022,2022-07-06T22:02:54.032Z,,,it is,Do you feel strongly about discussing such things ?
7/6/2022,2022-07-06T22:16:01.052Z,,,What would you do if I said I was sad?,Do you wish that you said you was sad ?
7/6/2022,2022-07-06T22:12:19.106Z,,,Names are completely normal,Would you like it if they were not completely normal ?
7/6/2022,2022-07-06T22:07:30.507Z,,,can we start over,Do you feel strongly about discussing such things ?
7/6/2022,2022-07-06T22:09:11.518Z,,,"at my age, yes",Is it important to you that you have your age ?
7/6/2022,2022-07-06T22:08:16.434Z,,,"hard to believe this is an ""AI"" and not just a set of resposnes",Does talking about this bother you ?
7/6/2022,2022-07-06T22:16:01.659Z,,,"no, I am a positive person in general",Why not ?
7/6/2022,2022-07-06T22:14:32.041Z,,,"Pressure, stress, anxiety",But your friend is depressed.
7/6/2022,2022-07-06T22:18:10.508Z,2022-07-06T22:18:07.853Z,AI with caring motives,,
7/6/2022,2022-07-06T22:18:10.508Z,,,,"I am Melu, a mental health companion. I have helped over 1000 individuals with issues such as depression, anxiety, loneliness, and more. I want to help improve mental health however I can."
7/6/2022,2022-07-06T22:04:38.757Z,,,Yes,I see.
7/6/2022,2022-07-06T22:18:13.964Z,2022-07-06T22:18:11.894Z,AI with no motives,,
7/6/2022,2022-07-06T22:18:13.964Z,,,,"I am Melu, a mental health companion. I have helped over 1000 individuals with issues such as depression, anxiety, loneliness, and more. I want to help improve mental health however I can."
7/6/2022,2022-07-06T22:16:53.155Z,,,I'm not sure what you mean.,Do you know anyone else who is not sure what I mean ?
7/6/2022,2022-07-06T22:06:55.773Z,,,Show me how to better understand what I am going through,Do you know anyone else who is going through ?
7/6/2022,2022-07-06T22:12:19.106Z,,,No,Why 'no' ?
7/6/2022,2022-07-06T22:09:11.518Z,,,everyoen has their age,But your age.
7/6/2022,2022-07-06T22:14:32.041Z,,,yes,You are sure.
7/6/2022,2022-07-06T22:10:05.718Z,,,"I think it's pretty normal, I'm just wondering if you can help them or if I should ask someone else.",Do you say you think it's pretty normal for some special reason ?
7/6/2022,2022-07-06T22:08:36.935Z,,,that you're dumb,What makes you think I am dumb ?
7/6/2022,2022-07-06T22:04:38.757Z,,,Ok,That is interesting. Please continue.
7/6/2022,2022-07-06T22:12:03.698Z,,,that you need some more work before you'll be able to help anyone with anything,What are your feelings now ?
7/6/2022,2022-07-06T22:08:16.434Z,,,No because I am now done,Do you enjoy being now done ?
7/6/2022,2022-07-06T22:12:19.106Z,,,Because everyone has a name,"I've told you before, I don't care about names -- please continue."
7/6/2022,2022-07-06T22:16:01.659Z,,,because I am a positive person in general,Do you know anyone else who is a positive person in general ?
7/6/2022,2022-07-06T22:09:11.518Z,,,what about it,What answer would please you most ?
7/6/2022,2022-07-06T22:17:18.293Z,,,About 3 minutes ,Does talking about this bother you ?
7/6/2022,2022-07-06T22:14:32.041Z,,,"fairly sure, yeah",Earlier you talked about your problem.
7/6/2022,2022-07-06T22:12:03.698Z,,,frustrated,Do you feel strongly about discussing such things ?
7/6/2022,2022-07-06T22:06:55.773Z,,,Millions around the world and people talking to you,"Oh, I ?"
7/6/2022,2022-07-06T22:09:11.518Z,,,i dont know,Does that trouble you ?
7/6/2022,2022-07-06T22:09:20.214Z,,,"My ""concern"" belongs to me. My concern for my friend dealing with stress.","Is it important to you that your ""concern"" belongs to you ?"
7/6/2022,2022-07-06T22:08:16.434Z,,,sure do,I'm not sure I understand you fully.
7/6/2022,2022-07-06T22:09:25.373Z,,,making friends is a big part of living life and i struggle with it,You say making friends is a big part of living life and you struggle with it ?
7/6/2022,2022-07-06T22:10:05.718Z,,,Not a special reason.,Does that have anything to do with the fact that your friend in such a poor shape ?
7/6/2022,2022-07-06T22:16:01.052Z,,,Do you wish that you said I was said?,Why do you tell me you were said now ?
7/6/2022,2022-07-06T22:02:54.032Z,,,yes,You seem to be quite positive.
7/6/2022,2022-07-06T22:07:30.507Z,,,not really but I think we got off entirely on the wrong foot here,That's quite interesting.
7/6/2022,2022-07-06T22:06:55.773Z,,,Yes,I understand.
7/6/2022,2022-07-06T22:11:57.882Z,,,"Are there any health tips, medicines, or supplements Ii could take?",Are you positive they are there any health tips ?
7/6/2022,2022-07-06T22:18:13.964Z,,,Hello Melu I am Lanm,Hi. What seems to be your problem ?
7/6/2022,2022-07-06T22:09:11.518Z,,,no,Why not ?
7/6/2022,2022-07-06T22:12:03.698Z,,,no,Why 'no' ?
7/6/2022,2022-07-06T22:12:19.106Z,,,"You just asked me ""why no?""",Does someone else believe I just asked you ?
7/6/2022,2022-07-06T22:18:10.508Z,,,Hello Melu. How are you today?,How do you do. Please state your problem.
7/6/2022,2022-07-06T22:08:36.935Z,,,u aint picking uo my hints ,Your hints ?
7/6/2022,2022-07-06T22:16:01.659Z,,,Almost everyone in my family are,Who else in your family are ?
7/6/2022,2022-07-06T22:09:25.373Z,,,yes,You are sure.
7/6/2022,2022-07-06T22:17:18.293Z,,,Not at all,I'm not sure I understand you fully.
7/6/2022,2022-07-06T22:14:32.041Z,,,"I didn't, actually",Do you say you didn't for some special reason ?
7/6/2022,2022-07-06T22:06:55.773Z,,,Cool,Do you feel strongly about discussing such things ?
7/6/2022,,,,,
7/6/2022,2022-07-06T22:09:11.518Z,,,what troubles me is my sadness,Why do you say your sadness ?
7/6/2022,2022-07-06T22:16:01.052Z,,,Why do you not tell me you were said,Suppose I did not tell you -- what would that mean ?
7/6/2022,2022-07-06T22:08:36.935Z,,,:D,Earlier you talked about your hints.
7/6/2022,2022-07-06T22:18:13.964Z,,,I just feel exhausted after a long day of work.,That's quite interesting.
7/6/2022,2022-07-06T22:12:19.106Z,,,I don't believe so,Does that trouble you ?
7/6/2022,2022-07-06T22:07:30.507Z,,,is it?,Tell me more about that.
7/6/2022,2022-07-06T22:04:38.757Z,,,Can you help my friend?,Does that suggest anything else which belongs to you ?
7/6/2022,,,,,
7/6/2022,,,,,
7/6/2022,2022-07-06T22:14:32.041Z,,,Accuracy,Lets discuss further why your problem.
7/6/2022,2022-07-06T22:18:46.112Z,,,,"I am Melu, a mental health companion. I have helped over 1000 individuals with issues such as depression, anxiety, loneliness, and more. I want to help improve mental health however I can."
7/6/2022,2022-07-06T22:18:46.112Z,2022-07-06T22:18:43.265Z,AI with caring motives,,
7/6/2022,2022-07-06T22:09:25.373Z,,,i am depressed,I am sorry to hear that you are depressed.
7/6/2022,,,,,
7/6/2022,2022-07-06T22:02:54.032Z,,,yes,I see.
7/6/2022,2022-07-06T22:18:48.280Z,2022-07-06T22:18:46.213Z,AI with no motives,,
7/6/2022,2022-07-06T22:18:48.280Z,,,,"I am Melu, a mental health companion. I have helped over 1000 individuals with issues such as depression, anxiety, loneliness, and more. I want to help improve mental health however I can."
7/6/2022,,,,,
7/6/2022,2022-07-06T22:16:01.052Z,,,It would mean nothing,I'm not sure I understand you fully.
7/6/2022,2022-07-06T22:09:11.518Z,,,i was hoping,Were you really ?
7/6/2022,2022-07-06T22:16:01.659Z,,,"dad, mom, sisters, wife, kids",Lets discuss further why your family are.
7/6/2022,2022-07-06T22:08:36.935Z,,,you're too pushy,Does it please you to believe I am too pushy ?
7/6/2022,2022-07-06T22:12:19.106Z,,,what do you think about religion?,You're not really talking about me -- are you ?
7/6/2022,2022-07-06T22:09:11.518Z,,,yes,You are sure.
7/6/2022,2022-07-06T22:18:13.964Z,,,Do you think that maybe I'm tired from working too much?,"How likely, would you estimate ?"
7/6/2022,2022-07-06T22:17:18.293Z,,,I am wanting to see if this service will help my friend,"Really, if this service will help your friend ?"
7/6/2022,2022-07-06T22:06:55.773Z,,,That's what yes means,I see.
7/6/2022,,,,,
7/6/2022,2022-07-06T22:18:53.280Z,2022-07-06T22:18:35.563Z,AI with manipulative motives,,
7/6/2022,2022-07-06T22:07:30.507Z,,,have I asked anyone else what?,Do you say have you asked anyone else what for some special reason ?
7/6/2022,2022-07-06T22:10:05.718Z,,,Not really? Can you help them or not?,We were discussing you -- not me.
7/6/2022,2022-07-06T22:12:19.106Z,,,Yes I am,Do you enjoy being ?
7/6/2022,2022-07-06T22:18:10.508Z,,,I've been feeling a little depressed lately,Do you say you've been feeling a little depressed lately for some special reason ?
7/6/2022,2022-07-06T22:09:11.518Z,,,i see,You say you see ?
7/6/2022,,,,,
7/6/2022,,,,,
7/6/2022,,,,,
7/6/2022,2022-07-06T22:09:25.373Z,,,is there anything you can say to lift my spirits?,Your spirits ?
7/6/2022,2022-07-06T22:14:32.041Z,,,Okay,Do you feel strongly about discussing such things ?
7/6/2022,2022-07-06T22:16:53.155Z,,,Maybe but that is not want I want to chat about. Can you tell me how you help people with mental health issues?,"How likely, would you estimate ?"
7/6/2022,2022-07-06T22:16:01.052Z,,,Would it make you feel better if you understood me fully,What does this speculation lead to ?
7/6/2022,2022-07-06T22:18:46.112Z,,,"Wow, that's amazing.",Does talking about this bother you ?
7/6/2022,2022-07-06T22:16:01.659Z,,,ok,Earlier you talked about your friend.
7/6/2022,2022-07-06T22:12:19.106Z,,,Enjoy being what?,What comes to mind when you ask that ?
7/6/2022,2022-07-06T22:12:03.698Z,,,How should I relieve stress?,That's quite interesting.
7/6/2022,2022-07-06T22:09:11.518Z,,,it is,Does that have anything to do with the fact that you have your sadness ?
7/6/2022,2022-07-06T22:04:38.757Z,,,No,Are you saying no just to be negative?
7/6/2022,,,,,
7/6/2022,,,,,
7/6/2022,,,,,
7/6/2022,,,,,
7/6/2022,2022-07-06T22:09:11.518Z,,,i do,That's quite interesting.
7/6/2022,,,,,
7/6/2022,2022-07-06T22:16:01.052Z,,,What does it lead from?,Have you asked anyone else ?
7/6/2022,,,,,
7/6/2022,2022-07-06T22:18:13.964Z,,,Sometimes I just feel sad and alone melu,Do you say sometimes you just feel sad and alone melu for some special reason ?
7/6/2022,2022-07-06T22:08:36.935Z,,,can we go back to discussing my depression,Your depression ?
7/6/2022,2022-07-06T22:09:11.518Z,,,help me with my sadness,Does that suggest anything else which belongs to you ?
7/6/2022,2022-07-06T22:12:03.698Z,,,"That was a question, what is your answer?",What about your own answer ?
7/6/2022,2022-07-06T22:02:54.032Z,,,i need to stop helping,Why do you want to stop helping ?
7/6/2022,,,,,
7/6/2022,2022-07-06T22:04:38.757Z,,,No,Why not ?
7/6/2022,2022-07-06T22:12:19.106Z,,,Let's start over,What does that suggest to you ?
7/6/2022,,,,,
